,id,title,authors,journal,year,doi,first_author,short_title,key
310,https://www.embase.com/search/results?subaction=viewrecord&id=L26394161&from=export,"The effect of tourniquet use in anterior cruciate ligament reconstruction: A prospective, randomized study","Arciero R.A., Scoville C.R., Hayda R.A., Snyder R.J.",American Journal of Sports Medicine (1996) 24:6 (758-764). Date of Publication: November/December 1996,1996,10.1177/036354659602400610,Arciero,theeffectoftourniquetuseinanteriorcruciateligamentreconstruction:aprospectiverandomizedstudy,Arciero+theeffectoftourniquetuseinanteriorcruciateligamentreconstruction:aprospectiverandomizedstudy+1996
311,https://www.embase.com/search/results?subaction=viewrecord&id=L125047149&from=export,Isolated intraarticular plasty of the semitendinosus or combined intra- and extra-articular plasty in chronic anterior laxity of the knee,"Goertzen M., Schulitz K.P.",Revue de chirurgie orthopédique et réparatrice de l'appareil moteur (1994) 80:2 (113-117). Date of Publication: 1994,1994,,Goertzen,isolatedintraarticularplastyofthesemitendinosusorcombinedintraandextraarticularplastyinchronicanteriorlaxityoftheknee,Goertzen+isolatedintraarticularplastyofthesemitendinosusorcombinedintraandextraarticularplastyinchronicanteriorlaxityoftheknee+1994
0,https://www.embase.com/search/results?subaction=viewrecord&id=L647350222&from=export,A semitendinosus with adjustable button graft construct in patients undergoing hamstring ACL reconstruction results in improved knee flexor strength symmetry and less donor site pain and morbidity: Outcomes from the DOSTAR randomized controlled trial,"Lawless A.M., Ebert J.R., Edwards P.K., Malik S.S., Davies P.S.E., D'Alessandro P.A.","Knee surgery, sports traumatology, arthroscopy : official journal of the ESSKA (2026) 34:2 (484-493). Date of Publication: 1 Feb 2026",2026,10.1002/ksa.12698,Lawless,asemitendinosuswithadjustablebuttongraftconstructinpatientsundergoinghamstringaclreconstructionresultsinimprovedkneeflexorstrengthsymmetryandlessdonorsitepainandmorbidity:outcomesfromthedostarrandomizedcontrolledtrial,Lawless+asemitendinosuswithadjustablebuttongraftconstructinpatientsundergoinghamstringaclreconstructionresultsinimprovedkneeflexorstrengthsymmetryandlessdonorsitepainandmorbidity:outcomesfromthedostarrandomizedcontrolledtrial+2026
1,https://www.embase.com/search/results?subaction=viewrecord&id=L2035801584&from=export,Five Weeks of Whole-body Vibration in Prehabilitation for Knee Function Following Anterior Cruciate Ligament Reconstruction: A Single-blinded Randomized Controlled Trial,"Qiu J., Ong M.T.-Y., Choi C.-Y., Cao M., Ko V.M.-C., He X., Fu S.-C., Fong D.T.P., Yung P.S.-H.",Sports Medicine - Open (2025) 11:1 Article Number: 98. Date of Publication: 1 Dec 2025,2025,10.1186/s40798-025-00901-1,Qiu,fiveweeksofwholebodyvibrationinprehabilitationforkneefunctionfollowinganteriorcruciateligamentreconstruction:asingleblindedrandomizedcontrolledtrial,Qiu+fiveweeksofwholebodyvibrationinprehabilitationforkneefunctionfollowinganteriorcruciateligamentreconstruction:asingleblindedrandomizedcontrolledtrial+2025
2,https://www.embase.com/search/results?subaction=viewrecord&id=L2036109189&from=export,Quadriceps versus hamstrings autograft in anterior cruciate ligament reconstruction: a randomized control trial,"Yadav A.K., Sharma A., Paul N., Bhakhar A., Sarkar B., Azam M.Q.",European Journal of Orthopaedic Surgery and Traumatology (2025) 35:1 Article Number: 395. Date of Publication: 1 Dec 2025,2025,10.1007/s00590-025-04510-2,Yadav,quadricepsversushamstringsautograftinanteriorcruciateligamentreconstruction:arandomizedcontroltrial,Yadav+quadricepsversushamstringsautograftinanteriorcruciateligamentreconstruction:arandomizedcontroltrial+2025
3,https://www.embase.com/search/results?subaction=viewrecord&id=L2040529555&from=export,Semitendinosus vs quadriceps tendon autograft in anterior cruciate ligament reconstruction (SEQUAR): protocol for a prospective randomized controlled trial,"Castellanos Dolk D., Sarakatsianos V., Wörner T., Östin M., Cristiani R., Kvist J., Stålman A.",BMC Musculoskeletal Disorders (2025) 26:1 Article Number: 951. Date of Publication: 1 Dec 2025,2025,10.1186/s12891-025-09183-w,Castellanos,semitendinosusvsquadricepstendonautograftinanteriorcruciateligamentreconstruction(sequar):protocolforaprospectiverandomizedcontrolledtrial,Castellanos+semitendinosusvsquadricepstendonautograftinanteriorcruciateligamentreconstruction(sequar):protocolforaprospectiverandomizedcontrolledtrial+2025
4,https://www.embase.com/search/results?subaction=viewrecord&id=L646603496&from=export,Evaluation of the Application of BOth Sides Up Ball Training Combined With Resistance Training in Joint Stability Improvement Following Anterior Cruciate Ligament Reconstruction Surgery in Teenage Athletes,"Cao X., Liu J., Zhao J., Feng S., Zhao Z.",Journal of sport rehabilitation (2025) 34:7 (733-739). Date of Publication: 1 Sep 2025,2025,10.1123/jsr.2024-0160,Cao,evaluationoftheapplicationofbothsidesupballtrainingcombinedwithresistancetraininginjointstabilityimprovementfollowinganteriorcruciateligamentreconstructionsurgeryinteenageathletes,Cao+evaluationoftheapplicationofbothsidesupballtrainingcombinedwithresistancetraininginjointstabilityimprovementfollowinganteriorcruciateligamentreconstructionsurgeryinteenageathletes+2025
5,https://www.embase.com/search/results?subaction=viewrecord&id=LNCT07145606&from=export,Effects of Early Rehabilitation Using Blood Flow Restriction and/or Surface Electromyography Biofeedback on Quadriceps Activation and Strength After Anterior Cruciate Ligament Reconstruction: A Multicenter Randomized Controlled Trial,,clinicaltrials.gov (2025). Date of Publication: 21 Aug 2025,2025,,,effectsofearlyrehabilitationusingbloodflowrestrictionand/orsurfaceelectromyographybiofeedbackonquadricepsactivationandstrengthafteranteriorcruciateligamentreconstruction:amulticenterrandomizedcontrolledtrial,
6,https://www.embase.com/search/results?subaction=viewrecord&id=L2036280159&from=export,Similar results with quadrupled semitendinosus and semitendinosus-gracilis graft in anterior cruciate ligament reconstruction: A randomised controlled trial with 2-year follow-up,"Martinez-Cano J.P., Gallego A., Cuadros J., Ibarra L., Mejía F.M., Velasquez-Hammerle M.V., Martinez-Rondanelli A.",Journal of Experimental Orthopaedics (2025) 12:3 Article Number: e70399. Date of Publication: 1 Jul 2025,2025,10.1002/jeo2.70399,Martinez-Cano,similarresultswithquadrupledsemitendinosusandsemitendinosusgracilisgraftinanteriorcruciateligamentreconstruction:arandomisedcontrolledtrialwith2yearfollowup,Martinez-Cano+similarresultswithquadrupledsemitendinosusandsemitendinosusgracilisgraftinanteriorcruciateligamentreconstruction:arandomisedcontrolledtrialwith2yearfollowup+2025
7,https://www.embase.com/search/results?subaction=viewrecord&id=L2040075838&from=export,Impact of early versus delayed rehabilitation protocols on lower limb strength symmetry after hamstring tendon autograft ACL reconstruction,"Kadivar Y., Katariya C., Merja H.",International Journal of Life Sciences Biotechnology and Pharma Research (2025) 14:7 (1656-1660). Date of Publication: 1 Jul 2025,2025,10.69605/ijlbpr_14.7.2025.278,Kadivar,impactofearlyversusdelayedrehabilitationprotocolsonlowerlimbstrengthsymmetryafterhamstringtendonautograftaclreconstruction,Kadivar+impactofearlyversusdelayedrehabilitationprotocolsonlowerlimbstrengthsymmetryafterhamstringtendonautograftaclreconstruction+2025
8,https://www.embase.com/search/results?subaction=viewrecord&id=L646302121&from=export,Kneeling tolerance when using quadriceps tendon autograft for anterior cruciate ligament reconstruction is superior to hamstring tendon autograft,"Calvert N.D., Ebert J.R., Radic R.","Knee surgery, sports traumatology, arthroscopy : official journal of the ESSKA (2025) 33:7 (2390-2396). Date of Publication: 1 Jul 2025",2025,10.1002/ksa.12583,Calvert,kneelingtolerancewhenusingquadricepstendonautograftforanteriorcruciateligamentreconstructionissuperiortohamstringtendonautograft,Calvert+kneelingtolerancewhenusingquadricepstendonautograftforanteriorcruciateligamentreconstructionissuperiortohamstringtendonautograft+2025
9,https://www.embase.com/search/results?subaction=viewrecord&id=LNCT07040384&from=export,Knee Extensors Activation Device Versus Rolled Towel for Early Quadriceps Activation After ACL Reconstruction: Protocol for a Randomized Controlled Trial,,clinicaltrials.gov (2025). Date of Publication: 18 Jun 2025,2025,,,kneeextensorsactivationdeviceversusrolledtowelforearlyquadricepsactivationafteraclreconstruction:protocolforarandomizedcontrolledtrial,
10,https://www.embase.com/search/results?subaction=viewrecord&id=L647612001&from=export,The addition of lateral extra-articular augmentation procedures to bone-tendon-bone or quadriceps autograft anterior cruciate ligament reconstruction does not negatively affect physical or psychological readiness for return to sport at 6 and 9 months,"LaPrade C.M., Carey E.G., Gachigi K.K., Erbe M., Gabriel C., Riboh J.C.","Knee surgery, sports traumatology, arthroscopy : official journal of the ESSKA (2025). Date of Publication: 1 Jun 2025",2025,10.1002/ksa.12710,LaPrade,theadditionoflateralextraarticularaugmentationprocedurestobonetendonboneorquadricepsautograftanteriorcruciateligamentreconstructiondoesnotnegativelyaffectphysicalorpsychologicalreadinessforreturntosportat6and9months,LaPrade+theadditionoflateralextraarticularaugmentationprocedurestobonetendonboneorquadricepsautograftanteriorcruciateligamentreconstructiondoesnotnegativelyaffectphysicalorpsychologicalreadinessforreturntosportat6and9months+2025
11,https://www.embase.com/search/results?subaction=viewrecord&id=LNCT06980285&from=export,ACL Reconstruction With Quadriceps Tendon Graft vs. Quadrupled Semitendinosus Graft: A Comparison of Patients From the Danish National ACL Reconstruction Database,,clinicaltrials.gov (2025). Date of Publication: 12 May 2025,2025,,,aclreconstructionwithquadricepstendongraftvsquadrupledsemitendinosusgraft:acomparisonofpatientsfromthedanishnationalaclreconstructiondatabase,
12,https://www.embase.com/search/results?subaction=viewrecord&id=L2034922817&from=export,"Anterior Cruciate Ligament Reconstruction Augmentation With Bone Marrow Aspirate Concentrate, Demineralized Bone Matrix, and Suture Tape Shows No Difference in Outcomes—But Faster Functional Recovery—Versus Non-augmented Anterior Cruciate Ligament Reconstruction","Lavender C.D., Schaver A.L., Taylor S., Peluso R., Berdis G., Singh V., Cipriani K., Lycans D., Jasko J., Hewett T.E.",Arthroscopy - Journal of Arthroscopic and Related Surgery (2025) 41:5 (1496-1508). Date of Publication: 1 May 2025,2025,10.1016/j.arthro.2024.06.042,Lavender,anteriorcruciateligamentreconstructionaugmentationwithbonemarrowaspirateconcentratedemineralizedbonematrixandsuturetapeshowsnodifferenceinoutcomes—butfasterfunctionalrecovery—versusnonaugmentedanteriorcruciateligamentreconstruction,Lavender+anteriorcruciateligamentreconstructionaugmentationwithbonemarrowaspirateconcentratedemineralizedbonematrixandsuturetapeshowsnodifferenceinoutcomes—butfasterfunctionalrecovery—versusnonaugmentedanteriorcruciateligamentreconstruction+2025
13,https://www.embase.com/search/results?subaction=viewrecord&id=LNCT06831279&from=export,Comparison of Two Different Rehabilitation Approaches Applied After Anterior Cruciate Ligament Reconstruction,,clinicaltrials.gov (2025). Date of Publication: 9 Jan 2025,2025,,,comparisonoftwodifferentrehabilitationapproachesappliedafteranteriorcruciateligamentreconstruction,
14,https://www.embase.com/search/results?subaction=viewrecord&id=L2039489736&from=export,"The effect of exercise rehabilitation on bone mineral density, muscle strength, and physical function outcomes in ACL ruptures: A randomized controlled clinical trial","Yue W., Ruilan D., Yunan Z., Wenqiang Y., Shuang R., Xi G., Yingfang A.",Sports Medicine and Health Science (2025). Date of Publication: 2025,2025,10.1016/j.smhs.2025.03.002,Yue,theeffectofexerciserehabilitationonbonemineraldensitymusclestrengthandphysicalfunctionoutcomesinaclruptures:arandomizedcontrolledclinicaltrial,Yue+theeffectofexerciserehabilitationonbonemineraldensitymusclestrengthandphysicalfunctionoutcomesinaclruptures:arandomizedcontrolledclinicaltrial+2025
15,https://www.embase.com/search/results?subaction=viewrecord&id=LNCT06755398&from=export,"The Effect of Cognitive-Based Neuromuscular Exercises on Reaction Time, Joint Position Sense, Proprioceptive Force Sense and Balance in Individuals Who Had Anterior Cruciate Ligament Surgery",,clinicaltrials.gov (2024). Date of Publication: 18 Dec 2024,2024,,,theeffectofcognitivebasedneuromuscularexercisesonreactiontimejointpositionsenseproprioceptiveforcesenseandbalanceinindividualswhohadanteriorcruciateligamentsurgery,
16,https://www.embase.com/search/results?subaction=viewrecord&id=L2029372496&from=export,"Vitamin D as an intervention for improving quadriceps muscle strength in patients after anterior cruciate ligament reconstruction: study protocol for a randomized double-blinded, placebo-controlled clinical trial","Ong M.T.-Y., Lu X., Choi B.C.-Y., Wan S.-W., Wang Q., Man G.C.-W., Lui P.P.-Y., Fong D.T.-P., Mok D.K.-W., Yung P.S.-H.",Trials (2024) 25:1 Article Number: 251. Date of Publication: 1 Dec 2024,2024,10.1186/s13063-024-08094-w,Ong,vitamindasaninterventionforimprovingquadricepsmusclestrengthinpatientsafteranteriorcruciateligamentreconstruction:studyprotocolforarandomizeddoubleblindedplacebocontrolledclinicaltrial,Ong+vitamindasaninterventionforimprovingquadricepsmusclestrengthinpatientsafteranteriorcruciateligamentreconstruction:studyprotocolforarandomizeddoubleblindedplacebocontrolledclinicaltrial+2024
17,https://www.embase.com/search/results?subaction=viewrecord&id=LNCT06727344&from=export,"Comparison of Conservative Treatment With Blood Flow Restriction With Standard Management in Total ACL Rupture. ""Randomized Clinical Trial""",,clinicaltrials.gov (2024). Date of Publication: 30 Nov 2024,2024,,,"comparisonofconservativetreatmentwithbloodflowrestrictionwithstandardmanagementintotalaclrupture""randomizedclinicaltrial""",
18,https://www.embase.com/search/results?subaction=viewrecord&id=L2031849110&from=export,"Effectiveness of In-Home, Augmented Reality–Based Telerehabilitation After Anterior Cruciate Ligament Reconstruction: A Randomized Controlled Trial","Lim J.Y., Yu H.J., Kim S.H., Lee J.I., Lim J.-Y., Wang J.H., Hwang J.H.",Orthopaedic Journal of Sports Medicine (2024) 12:10. Date of Publication: 1 Oct 2024,2024,10.1177/23259671241271729,Lim,effectivenessofinhomeaugmentedreality–basedtelerehabilitationafteranteriorcruciateligamentreconstruction:arandomizedcontrolledtrial,Lim+effectivenessofinhomeaugmentedreality–basedtelerehabilitationafteranteriorcruciateligamentreconstruction:arandomizedcontrolledtrial+2024
19,https://www.embase.com/search/results?subaction=viewrecord&id=L2031142545&from=export,IMPACT OF NEUROMUSCULAR ELECTRICAL STIMULATION (NMES) COMBINED WITH THERAPEUTIC EXERCISE ON POSTOPERATIVE ACL REHABILITATION,"Khan A.M., Tariq S., Kamran M., Sadiq A., Adnan H., Qazi Z.N., Khan M.",Journal of Population Therapeutics and Clinical Pharmacology (2024) 31:9 (645-651). Date of Publication: 2 Sep 2024,2024,10.53555/yqb1tm68,Khan,impactofneuromuscularelectricalstimulation(nmes)combinedwiththerapeuticexerciseonpostoperativeaclrehabilitation,Khan+impactofneuromuscularelectricalstimulation(nmes)combinedwiththerapeuticexerciseonpostoperativeaclrehabilitation+2024
20,https://www.embase.com/search/results?subaction=viewrecord&id=LNCT06430775&from=export,Exploring Prolonged Arthrogenic Muscle Responses and Associated Factors After Anterior Cruciate Ligament Reconstruction,,clinicaltrials.gov (2024). Date of Publication: 17 May 2024,2024,,,exploringprolongedarthrogenicmuscleresponsesandassociatedfactorsafteranteriorcruciateligamentreconstruction,
21,https://www.embase.com/search/results?subaction=viewrecord&id=L643379605&from=export,A Prospective Randomized Controlled Trial Investigating Quadriceps Versus Hamstring Tendon Autograft in Anterior Cruciate Ligament Reconstruction,"Ebert J.R., Calvert N.D., Radic R.",The American journal of sports medicine (2024) 52:3 (660-669). Date of Publication: 1 Mar 2024,2024,10.1177/03635465231222279,Ebert,aprospectiverandomizedcontrolledtrialinvestigatingquadricepsversushamstringtendonautograftinanteriorcruciateligamentreconstruction,Ebert+aprospectiverandomizedcontrolledtrialinvestigatingquadricepsversushamstringtendonautograftinanteriorcruciateligamentreconstruction+2024
22,https://www.embase.com/search/results?subaction=viewrecord&id=L2024539214&from=export,A prospective randomized controlled study of hamstring and bone-free quadriceps tendons autografts in arthroscopic ACL reconstruction,"Tang N., Eren M., Gurpinar T., Ozturkmen Y.",European Journal of Orthopaedic Surgery and Traumatology (2024) 34:1 (293-301). Date of Publication: 1 Jan 2024,2024,10.1007/s00590-023-03636-5,Tang,aprospectiverandomizedcontrolledstudyofhamstringandbonefreequadricepstendonsautograftsinarthroscopicaclreconstruction,Tang+aprospectiverandomizedcontrolledstudyofhamstringandbonefreequadricepstendonsautograftsinarthroscopicaclreconstruction+2024
23,https://www.embase.com/search/results?subaction=viewrecord&id=L2030479259&from=export,Transcutaneous Electrical Nerve Stimulation Provides Early Recovery from Arthrogenic Muscle Inhibition Post-Anterior Cruciate Ligament Reconstruction,"Khan F.A., Kushwaha S., Vakharia K., Kumar J., BhaVani P., Sinha S.",Journal of Arthroscopy and Joint Surgery (2024) 11:1 (22-27). Date of Publication: 1 Jan 2024,2024,10.4103/jajs.jajs_137_22,Khan,transcutaneouselectricalnervestimulationprovidesearlyrecoveryfromarthrogenicmuscleinhibitionpostanteriorcruciateligamentreconstruction,Khan+transcutaneouselectricalnervestimulationprovidesearlyrecoveryfromarthrogenicmuscleinhibitionpostanteriorcruciateligamentreconstruction+2024
24,https://www.embase.com/search/results?subaction=viewrecord&id=L2035070509&from=export,Which technique provides more benefits in return to sports and clinical outcomes after anterior cruciate ligament reconstruction: Double-bundle or single-bundle? A randomized controlled study,"Wang X., Xu Z., Song S., Mao Z., Huang X., Luo M., Zhou X., Xu B., Ye J., Song Y., Yu J.",Chinese Medical Journal (2024) Article Number: e03267. Date of Publication: 2024,2024,10.1097/CM9.0000000000003267,Wang,whichtechniqueprovidesmorebenefitsinreturntosportsandclinicaloutcomesafteranteriorcruciateligamentreconstruction:doublebundleorsinglebundle?arandomizedcontrolledstudy,Wang+whichtechniqueprovidesmorebenefitsinreturntosportsandclinicaloutcomesafteranteriorcruciateligamentreconstruction:doublebundleorsinglebundle?arandomizedcontrolledstudy+2024
25,https://www.embase.com/search/results?subaction=viewrecord&id=LNCT06189573&from=export,"Reconstruction of the Anterior Cruciated Ligament With Quadriceps Tendon Graft With Bone Plug vs Bone Patellar Tendon Bone Graft, a Randomized Clinical Controlled Essay With 2 Years of Follow up",,clinicaltrials.gov (2023). Date of Publication: 2 Dec 2023,2023,,,reconstructionoftheanteriorcruciatedligamentwithquadricepstendongraftwithboneplugvsbonepatellartendonbonegraftarandomizedclinicalcontrolledessaywith2yearsoffollowup,
26,https://www.embase.com/search/results?subaction=viewrecord&id=L2034905231&from=export,Functional Outcomes of Quadriceps Tendon versus Hamstring Tendon Autograft using Suspensory Fixation at Femoral and Tibial Sites for Primary Anterior Cruciate Ligament Reconstruction: A Randomised Controlled Study,"Khatri R.Y., Patil V., Kulkarni S., Naik S., Nandi S.",Journal of Clinical and Diagnostic Research (2023) 17:8 (RC17-RC21). Date of Publication: 1 Aug 2023,2023,10.7860/JCDR/2023/64284.18350,Khatri,functionaloutcomesofquadricepstendonversushamstringtendonautograftusingsuspensoryfixationatfemoralandtibialsitesforprimaryanteriorcruciateligamentreconstruction:arandomisedcontrolledstudy,Khatri+functionaloutcomesofquadricepstendonversushamstringtendonautograftusingsuspensoryfixationatfemoralandtibialsitesforprimaryanteriorcruciateligamentreconstruction:arandomisedcontrolledstudy+2023
27,https://www.embase.com/search/results?subaction=viewrecord&id=LNCT05904158&from=export,Effects of Platelet-Rich Fibrin on Knee Muscle Strength and Function in Patients With Anterior Cruciate Ligament Reconstruction,,clinicaltrials.gov (2023). Date of Publication: 27 May 2023,2023,,,effectsofplateletrichfibrinonkneemusclestrengthandfunctioninpatientswithanteriorcruciateligamentreconstruction,
28,https://www.embase.com/search/results?subaction=viewrecord&id=LNCT05876013&from=export,Reduced Knee Flexion Strength 18 Years After ACL Reconstruction in Hamstring Group,,clinicaltrials.gov (2023). Date of Publication: 17 Apr 2023,2023,,,reducedkneeflexionstrength18yearsafteraclreconstructioninhamstringgroup,
29,https://www.embase.com/search/results?subaction=viewrecord&id=LNCT05673356&from=export,Anterior Cruciate Ligament Reconstruction With Quadriceps Tendon Bone Autograft,,clinicaltrials.gov (2023). Date of Publication: 4 Jan 2023,2023,,,anteriorcruciateligamentreconstructionwithquadricepstendonboneautograft,
30,https://www.embase.com/search/results?subaction=viewrecord&id=L2019065221&from=export,"Effect of pulsed electromagnetic field as an intervention for patients with quadriceps weakness after anterior cruciate ligament reconstruction: a double-blinded, randomized-controlled trial","Ong M.T.-Y., Man G.C.-W., Lau L.C.-M., He X., Qiu J., Wang Q., Chow M.C.-S., Choi B.C.-Y., Yu M., Yung P.S.-H.",Trials (2022) 23:1 Article Number: 771. Date of Publication: 1 Dec 2022,2022,10.1186/s13063-022-06674-2,Ong,effectofpulsedelectromagneticfieldasaninterventionforpatientswithquadricepsweaknessafteranteriorcruciateligamentreconstruction:adoubleblindedrandomizedcontrolledtrial,Ong+effectofpulsedelectromagneticfieldasaninterventionforpatientswithquadricepsweaknessafteranteriorcruciateligamentreconstruction:adoubleblindedrandomizedcontrolledtrial+2022
31,https://www.embase.com/search/results?subaction=viewrecord&id=LNCT05738200&from=export,Use of Nordic Hamstring Exercise to Improve Hamstrings Function in Patients After ACL Reconstruction,,clinicaltrials.gov (2022). Date of Publication: 2 Nov 2022,2022,,,useofnordichamstringexercisetoimprovehamstringsfunctioninpatientsafteraclreconstruction,
32,https://www.embase.com/search/results?subaction=viewrecord&id=L639177457&from=export,Comparison of Quadriceps and Hamstring Muscle Strength after Exercises with and without Blood Flow Restriction following Anterior Cruciate Ligament Surgery: A Randomized Controlled Trial,"Vieira de Melo R.F., Komatsu W.R., Freitas M.S., Vieira de Melo M.E., Cohen M.",Journal of rehabilitation medicine (2022) 54 (jrm00337). Date of Publication: 1 Nov 2022,2022,10.2340/jrm.v54.2550,Vieira,comparisonofquadricepsandhamstringmusclestrengthafterexerciseswithandwithoutbloodflowrestrictionfollowinganteriorcruciateligamentsurgery:arandomizedcontrolledtrial,Vieira+comparisonofquadricepsandhamstringmusclestrengthafterexerciseswithandwithoutbloodflowrestrictionfollowinganteriorcruciateligamentsurgery:arandomizedcontrolledtrial+2022
33,https://www.embase.com/search/results?subaction=viewrecord&id=LNCT05580133&from=export,All-Inside Single-Bundle for ACL Reconstruction With Full Thickness of the Peroneus Longus Tendon Compared to the Six-strand-hamstring Autograft,,clinicaltrials.gov (2022). Date of Publication: 27 Sep 2022,2022,,,allinsidesinglebundleforaclreconstructionwithfullthicknessoftheperoneuslongustendoncomparedtothesixstrandhamstringautograft,
34,https://www.embase.com/search/results?subaction=viewrecord&id=LNCT05489627&from=export,Medial Collateral Ligament Reconstruction With Anteromedial Reinforcement for Medial and Anteromedial Rotatory Knee Instability,,clinicaltrials.gov (2022). Date of Publication: 3 Aug 2022,2022,,,medialcollateralligamentreconstructionwithanteromedialreinforcementformedialandanteromedialrotatorykneeinstability,
35,https://www.embase.com/search/results?subaction=viewrecord&id=LNCT05461326&from=export,All Soft Tissue Quadriceps Tendon Autograft Versus Patellar Tendon Autograft in Anterior Cruciate Ligament Reconstruction: a Randomized Controlled Trial,,clinicaltrials.gov (2022). Date of Publication: 28 Jun 2022,2022,,,allsofttissuequadricepstendonautograftversuspatellartendonautograftinanteriorcruciateligamentreconstruction:arandomizedcontrolledtrial,
36,https://www.embase.com/search/results?subaction=viewrecord&id=LNCT05481918&from=export,Normalization of Gait After ACL Reconstruction: A Comparative Study Between Home-based Versus Standardized Therapy,,clinicaltrials.gov (2022). Date of Publication: 20 Jun 2022,2022,,,normalizationofgaitafteraclreconstruction:acomparativestudybetweenhomebasedversusstandardizedtherapy,
37,https://www.embase.com/search/results?subaction=viewrecord&id=LNCT05426954&from=export,Blood Flow Restrictive Training Following Medial Patellofemoral Ligament and Anterior Cruciate Ligament Reconstruction Rehabilitation,,clinicaltrials.gov (2022). Date of Publication: 2 Jun 2022,2022,,,bloodflowrestrictivetrainingfollowingmedialpatellofemoralligamentandanteriorcruciateligamentreconstructionrehabilitation,
