,id,title,authors,journal,year,doi,first_author,short_title,key
205,16552549,Randomized prospective study of ACL reconstruction with interference screw fixation in patellar tendon autografts versus femoral metal plate suspension and tibial post fixation in hamstring tendon autografts: 5-year clinical and radiological follow-up results,"Harilainen A, Linko E, Sandelin J.",Knee Surg Sports Traumatol Arthrosc,2006,10.1007/s00167-006-0059-0,Harilainen,randomizedprospectivestudyofaclreconstructionwithinterferencescrewfixationinpatellartendonautograftsversusfemoralmetalplatesuspensionandtibialpostfixationinhamstringtendonautografts:5yearclinicalandradiologicalfollowupresults,Harilainen+randomizedprospectivestudyofaclreconstructionwithinterferencescrewfixationinpatellartendonautograftsversusfemoralmetalplatesuspensionandtibialpostfixationinhamstringtendonautografts:5yearclinicalandradiologicalfollowupresults+2006
206,16517306,Clinical evaluation of anatomic double-bundle anterior cruciate ligament reconstruction procedure using hamstring tendon grafts: comparisons among 3 different procedures,"Yasuda K, Kondo E, Ichiyama H, Tanabe Y, Tohyama H.",Arthroscopy,2006,10.1016/j.arthro.2005.12.017,Yasuda,clinicalevaluationofanatomicdoublebundleanteriorcruciateligamentreconstructionprocedureusinghamstringtendongrafts:comparisonsamong3differentprocedures,Yasuda+clinicalevaluationofanatomicdoublebundleanteriorcruciateligamentreconstructionprocedureusinghamstringtendongrafts:comparisonsamong3differentprocedures+2006
207,16496124,Factors affecting return to sports after anterior cruciate ligament reconstruction with patellar tendon and hamstring graft: a prospective clinical investigation,"Gobbi A, Francisco R.",Knee Surg Sports Traumatol Arthrosc,2006,10.1007/s00167-006-0050-9,Gobbi,factorsaffectingreturntosportsafteranteriorcruciateligamentreconstructionwithpatellartendonandhamstringgraft:aprospectiveclinicalinvestigation,Gobbi+factorsaffectingreturntosportsafteranteriorcruciateligamentreconstructionwithpatellartendonandhamstringgraft:aprospectiveclinicalinvestigation+2006
208,16465537,Prospective randomized clinical comparison of femoral transfixation versus bioscrew fixation in hamstring tendon ACL reconstruction--a preliminary report,"Rose T, Hepp P, Venus J, Stockmar C, Josten C, Lill H.",Knee Surg Sports Traumatol Arthrosc,2006,10.1007/s00167-006-0034-9,Rose,prospectiverandomizedclinicalcomparisonoffemoraltransfixationversusbioscrewfixationinhamstringtendonaclreconstructionapreliminaryreport,Rose+prospectiverandomizedclinicalcomparisonoffemoraltransfixationversusbioscrewfixationinhamstringtendonaclreconstructionapreliminaryreport+2006
209,16325084,Tunnel widening after hamstring anterior cruciate ligament reconstruction is influenced by the type of graft fixation used: a prospective randomized study,"Fauno P, Kaalund S.",Arthroscopy,2005,10.1016/j.arthro.2005.08.023,Fauno,tunnelwideningafterhamstringanteriorcruciateligamentreconstructionisinfluencedbythetypeofgraftfixationused:aprospectiverandomizedstudy,Fauno+tunnelwideningafterhamstringanteriorcruciateligamentreconstructionisinfluencedbythetypeofgraftfixationused:aprospectiverandomizedstudy+2005
210,16292682,A prospective comparison of bone-patellar tendon-bone and hamstring grafts for anterior cruciate ligament reconstruction in female patients,"Svensson M, Sernert N, Ejerhed L, Karlsson J, Kartus JT.",Knee Surg Sports Traumatol Arthrosc,2006,10.1007/s00167-005-0708-8,Svensson,aprospectivecomparisonofbonepatellartendonboneandhamstringgraftsforanteriorcruciateligamentreconstructioninfemalepatients,Svensson+aprospectivecomparisonofbonepatellartendonboneandhamstringgraftsforanteriorcruciateligamentreconstructioninfemalepatients+2006
211,16282583,A comparison of bone-patellar tendon-bone and bone-hamstring tendon-bone autografts for anterior cruciate ligament reconstruction,"Matsumoto A, Yoshiya S, Muratsu H, Yagi M, Iwasaki Y, Kurosaka M, Kuroda R.",Am J Sports Med,2006,10.1177/0363546505279919,Matsumoto,acomparisonofbonepatellartendonboneandbonehamstringtendonboneautograftsforanteriorcruciateligamentreconstruction,Matsumoto+acomparisonofbonepatellartendonboneandbonehamstringtendonboneautograftsforanteriorcruciateligamentreconstruction+2006
212,16167266,"[Subsequent treatment of surgically managed, fresh, anterior cruciate ligament ruptures--a randomized, prospective study]","Pförringer W, Kremer C.",Sportverletz Sportschaden,2005,10.1055/s-2005-858472,Pförringer,subsequenttreatmentofsurgicallymanagedfreshanteriorcruciateligamentrupturesarandomizedprospectivestudy,Pförringer+subsequenttreatmentofsurgicallymanagedfreshanteriorcruciateligamentrupturesarandomizedprospectivestudy+2005
213,16131675,Comparing 2-year outcomes of anterior cruciate ligament reconstruction using either patella-tendon or semitendinosus-tendon autografts: a non-randomised prospective study,"Tow BP, Chang PC, Mitra AK, Tay BK, Wong MC.",J Orthop Surg (Hong Kong),2005,10.1177/230949900501300206,Tow,comparing2yearoutcomesofanteriorcruciateligamentreconstructionusingeitherpatellatendonorsemitendinosustendonautografts:anonrandomisedprospectivestudy,Tow+comparing2yearoutcomesofanteriorcruciateligamentreconstructionusingeitherpatellatendonorsemitendinosustendonautografts:anonrandomisedprospectivestudy+2005
214,16024251,Two-bundle anterior cruciate ligament reconstruction with eight-stranded hamstring tendons: four-tunnel technique,"Zhao J, Peng X, He Y, Wang J.",Knee,2006,10.1016/j.knee.2005.05.001,Zhao,twobundleanteriorcruciateligamentreconstructionwitheightstrandedhamstringtendons:fourtunneltechnique,Zhao+twobundleanteriorcruciateligamentreconstructionwitheightstrandedhamstringtendons:fourtunneltechnique+2006
215,15800520,Clinical evaluation of arthroscopically assisted anterior cruciate ligament reconstruction: patellar tendon versus gracilis and semitendinosus autograft,"Ibrahim SA, Al-Kussary IM, Al-Misfer AR, Al-Mutairi HQ, Ghafar SA, El Noor TA.",Arthroscopy,2005,10.1016/j.arthro.2004.12.002,Ibrahim,clinicalevaluationofarthroscopicallyassistedanteriorcruciateligamentreconstruction:patellartendonversusgracilisandsemitendinosusautograft,Ibrahim+clinicalevaluationofarthroscopicallyassistedanteriorcruciateligamentreconstruction:patellartendonversusgracilisandsemitendinosusautograft+2005
216,15756612,Anterior cruciate ligament reconstruction with double-looped semitendinosus and gracilis tendon graft directly fixed to cortical bone: 5-year results,"Giron F, Aglietti P, Cuomo P, Mondanelli N, Ciardullo A.",Knee Surg Sports Traumatol Arthrosc,2005,10.1007/s00167-004-0553-1,Giron,anteriorcruciateligamentreconstructionwithdoubleloopedsemitendinosusandgracilistendongraftdirectlyfixedtocorticalbone:5yearresults,Giron+anteriorcruciateligamentreconstructionwithdoubleloopedsemitendinosusandgracilistendongraftdirectlyfixedtocorticalbone:5yearresults+2005
217,15756179,Hamstring anterior cruciate ligament reconstruction: is it necessary to sacrifice the gracilis?,"Gobbi A, Domzalski M, Pascual J, Zanazzo M.",Arthroscopy,2005,10.1016/j.arthro.2004.10.016,Gobbi,hamstringanteriorcruciateligamentreconstruction:isitnecessarytosacrificethegracilis?,Gobbi+hamstringanteriorcruciateligamentreconstruction:isitnecessarytosacrificethegracilis?+2005
218,15723704,"Resorbable screws versus pins for optimal transplant fixation (SPOT) in anterior cruciate ligament replacement with autologous hamstring grafts: rationale and design of a randomized, controlled, patient and investigator blinded trial [ISRCTN17384369]","Stengel D, Matthes G, Seifert J, Tober V, Mutze S, Rademacher G, Ekkernkamp A, Bauwens K, Wich M, Casper D; SPOT Group.",BMC Surg,2005,10.1186/1471-2482-5-1,Stengel,resorbablescrewsversuspinsforoptimaltransplantfixation(spot)inanteriorcruciateligamentreplacementwithautologoushamstringgrafts:rationaleanddesignofarandomizedcontrolledpatientandinvestigatorblindedtrialisrctn17384369,Stengel+resorbablescrewsversuspinsforoptimaltransplantfixation(spot)inanteriorcruciateligamentreplacementwithautologoushamstringgrafts:rationaleanddesignofarandomizedcontrolledpatientandinvestigatorblindedtrialisrctn17384369+2005
219,15711494,[Reliability of the KT-1000 arthrometer (Medmetric) for measuring anterior knee laxity: comparison with Telos in 147 knees],"Boyer P, Djian P, Christel P, Paoletti X, Degeorges R.",Rev Chir Orthop Reparatrice Appar Mot,2004,10.1016/s0035-1040(04)70756-4,Boyer,reliabilityofthekt1000arthrometer(medmetric)formeasuringanteriorkneelaxity:comparisonwithtelosin147knees,Boyer+reliabilityofthekt1000arthrometer(medmetric)formeasuringanteriorkneelaxity:comparisonwithtelosin147knees+2004
220,15650664,A prospective randomized comparison of bone-patellar tendon-bone and hamstring grafts for anterior cruciate ligament reconstruction,"Laxdal G, Kartus J, Hansson L, Heidvall M, Ejerhed L, Karlsson J.",Arthroscopy,2005,10.1016/j.arthro.2004.09.014,Laxdal,aprospectiverandomizedcomparisonofbonepatellartendonboneandhamstringgraftsforanteriorcruciateligamentreconstruction,Laxdal+aprospectiverandomizedcomparisonofbonepatellartendonboneandhamstringgraftsforanteriorcruciateligamentreconstruction+2005
221,15650663,Cross-pin femoral fixation versus metal interference screw fixation in anterior cruciate ligament reconstruction with hamstring tendons: results of a controlled prospective randomized study with 2-year follow-up,"Harilainen A, Sandelin J, Jansson KA.",Arthroscopy,2005,10.1016/j.arthro.2004.09.013,Harilainen,crosspinfemoralfixationversusmetalinterferencescrewfixationinanteriorcruciateligamentreconstructionwithhamstringtendons:resultsofacontrolledprospectiverandomizedstudywith2yearfollowup,Harilainen+crosspinfemoralfixationversusmetalinterferencescrewfixationinanteriorcruciateligamentreconstructionwithhamstringtendons:resultsofacontrolledprospectiverandomizedstudywith2yearfollowup+2005
222,15611004,The influence of supplementary tibial fixation on laxity measurements after anterior cruciate ligament reconstruction with hamstring tendons in female patients,"Hill PF, Russell VJ, Salmon LJ, Pinczewski LA.",Am J Sports Med,2005,10.1177/0363546504268036,Hill,theinfluenceofsupplementarytibialfixationonlaxitymeasurementsafteranteriorcruciateligamentreconstructionwithhamstringtendonsinfemalepatients,Hill+theinfluenceofsupplementarytibialfixationonlaxitymeasurementsafteranteriorcruciateligamentreconstructionwithhamstringtendonsinfemalepatients+2005
223,15516013,Arthroscopically assisted anterior cruciate ligament reconstruction: comparison of bone-patellar tendon-bone versus hamstring tendon autograft,"Boonriong T, Kietsiriroje N.",J Med Assoc Thai,2004,,Boonriong,arthroscopicallyassistedanteriorcruciateligamentreconstruction:comparisonofbonepatellartendonboneversushamstringtendonautograft,Boonriong+arthroscopicallyassistedanteriorcruciateligamentreconstruction:comparisonofbonepatellartendonboneversushamstringtendonautograft+2004
224,15466722,"Anterior cruciate ligament reconstruction: bone-patellar tendon-bone compared with double semitendinosus and gracilis tendon grafts. A prospective, randomized clinical trial","Aglietti P, Giron F, Buzzi R, Biddau F, Sasso F.",J Bone Joint Surg Am,2004,,Aglietti,anteriorcruciateligamentreconstruction:bonepatellartendonbonecomparedwithdoublesemitendinosusandgracilistendongraftsaprospectiverandomizedclinicaltrial,Aglietti+anteriorcruciateligamentreconstruction:bonepatellartendonbonecomparedwithdoublesemitendinosusandgracilistendongraftsaprospectiverandomizedclinicaltrial+2004
225,15292958,[Anterior cruciate ligament reconstruction with hamstring tendons in the young],"Sobau C, Ellermann A.",Unfallchirurg,2004,10.1007/s00113-004-0809-8,Sobau,anteriorcruciateligamentreconstructionwithhamstringtendonsintheyoung,Sobau+anteriorcruciateligamentreconstructionwithhamstringtendonsintheyoung+2004
226,15174545,Reconstruction of the anterior cruciate ligament. Single- versus double-bundle multistranded hamstring tendons,"Adachi N, Ochi M, Uchio Y, Iwasa J, Kuriwaka M, Ito Y.",J Bone Joint Surg Br,2004,,Adachi,reconstructionoftheanteriorcruciateligamentsingleversusdoublebundlemultistrandedhamstringtendons,Adachi+reconstructionoftheanteriorcruciateligamentsingleversusdoublebundlemultistrandedhamstringtendons+2004
227,15060762,Arthroscopic anterior cruciate ligament reconstruction with periosteum-enveloping hamstring tendon graft,"Chen CH, Chen WJ, Shih CH, Chou SW.",Knee Surg Sports Traumatol Arthrosc,2004,10.1007/s00167-004-0498-4,Chen,arthroscopicanteriorcruciateligamentreconstructionwithperiosteumenvelopinghamstringtendongraft,Chen+arthroscopicanteriorcruciateligamentreconstructionwithperiosteumenvelopinghamstringtendongraft+2004
228,14754739,Augmentation of femoral fixation in hamstring anterior cruciate ligament reconstruction with a bioabsorbable bead: a prospective single-blind randomized clinical trial,"Arneja S, Froese W, MacDonald P.",Am J Sports Med,2004,10.1177/0095399703258675,Arneja,augmentationoffemoralfixationinhamstringanteriorcruciateligamentreconstructionwithabioabsorbablebead:aprospectivesingleblindrandomizedclinicaltrial,Arneja+augmentationoffemoralfixationinhamstringanteriorcruciateligamentreconstructionwithabioabsorbablebead:aprospectivesingleblindrandomizedclinicaltrial+2004
229,13680104,The role of periosteal flap in the prevention of femoral widening in anterior cruciate ligament reconstruction using hamstring tendons,"Robert H, Es-Sayeh J.",Knee Surg Sports Traumatol Arthrosc,2004,10.1007/s00167-003-0380-9,Robert,theroleofperiostealflapinthepreventionoffemoralwideninginanteriorcruciateligamentreconstructionusinghamstringtendons,Robert+theroleofperiostealflapinthepreventionoffemoralwideninginanteriorcruciateligamentreconstructionusinghamstringtendons+2004
230,12860546,A randomized comparison of patellar tendon and hamstring tendon anterior cruciate ligament reconstruction,"Feller JA, Webster KE.",Am J Sports Med,2003,10.1177/03635465030310041501,Feller,arandomizedcomparisonofpatellartendonandhamstringtendonanteriorcruciateligamentreconstruction,Feller+arandomizedcomparisonofpatellartendonandhamstringtendonanteriorcruciateligamentreconstruction+2003
231,12860538,Clinical outcome of anterior cruciate ligament reconstruction with quadrupled hamstring tendon graft and bioabsorbable interference screw fixation,"Charlton WP, Randolph DA Jr, Lemos S, Shields CL Jr.",Am J Sports Med,2003,10.1177/03635465030310040701,Charlton,clinicaloutcomeofanteriorcruciateligamentreconstructionwithquadrupledhamstringtendongraftandbioabsorbableinterferencescrewfixation,Charlton+clinicaloutcomeofanteriorcruciateligamentreconstructionwithquadrupledhamstringtendongraftandbioabsorbableinterferencescrewfixation+2003
232,12793556,Outcome after reconstruction of the anterior cruciate ligament in athletic patients. A comparison of early versus delayed surgery,"Meighan AA, Keating JF, Will E.",J Bone Joint Surg Br,2003,10.1302/0301-620x.85b4.13743,Meighan,outcomeafterreconstructionoftheanteriorcruciateligamentinathleticpatientsacomparisonofearlyversusdelayedsurgery,Meighan+outcomeafterreconstructionoftheanteriorcruciateligamentinathleticpatientsacomparisonofearlyversusdelayedsurgery+2003
233,12531752,Patellar tendon or semitendinosus tendon autografts for anterior cruciate ligament reconstruction? A prospective randomized study with a two-year follow-up,"Ejerhed L, Kartus J, Sernert N, Köhler K, Karlsson J.",Am J Sports Med,2003,10.1177/03635465030310011401,Ejerhed,patellartendonorsemitendinosustendonautograftsforanteriorcruciateligamentreconstruction?aprospectiverandomizedstudywithatwoyearfollowup,Ejerhed+patellartendonorsemitendinosustendonautograftsforanteriorcruciateligamentreconstruction?aprospectiverandomizedstudywithatwoyearfollowup+2003
234,12531751,A prospective randomized study of patellar versus hamstring tendon autografts for anterior cruciate ligament reconstruction,"Jansson KA, Linko E, Sandelin J, Harilainen A.",Am J Sports Med,2003,10.1177/03635465030310010501,Jansson,aprospectiverandomizedstudyofpatellarversushamstringtendonautograftsforanteriorcruciateligamentreconstruction,Jansson+aprospectiverandomizedstudyofpatellarversushamstringtendonautograftsforanteriorcruciateligamentreconstruction+2003
235,12208905,"Anterior cruciate ligament replacement: comparison of bone-patellar tendon-bone grafts with two-strand hamstring grafts. A prospective, randomized study","Beynnon BD, Johnson RJ, Fleming BC, Kannus P, Kaplan M, Samani J, Renström P.",J Bone Joint Surg Am,2002,10.2106/00004623-200209000-00001,Beynnon,anteriorcruciateligamentreplacement:comparisonofbonepatellartendonbonegraftswithtwostrandhamstringgraftsaprospectiverandomizedstudy,Beynnon+anteriorcruciateligamentreplacement:comparisonofbonepatellartendonbonegraftswithtwostrandhamstringgraftsaprospectiverandomizedstudy+2002
236,12130407,A five-year comparison of patellar tendon versus four-strand hamstring tendon autograft for arthroscopic reconstruction of the anterior cruciate ligament,"Pinczewski LA, Deehan DJ, Salmon LJ, Russell VJ, Clingeleffer A.",Am J Sports Med,2002,10.1177/03635465020300041201,Pinczewski,afiveyearcomparisonofpatellartendonversusfourstrandhamstringtendonautograftforarthroscopicreconstructionoftheanteriorcruciateligament,Pinczewski+afiveyearcomparisonofpatellartendonversusfourstrandhamstringtendonautograftforarthroscopicreconstructionoftheanteriorcruciateligament+2002
237,12121424,Range of motion training in brace vs. plaster immobilization after anterior cruciate ligament reconstruction: a prospective randomized comparison with a 2-year follow-up,"Henriksson M, Rockborn P, Good L.",Scand J Med Sci Sports,2002,10.1034/j.1600-0838.2002.120203.x,Henriksson,rangeofmotiontraininginbracevsplasterimmobilizationafteranteriorcruciateligamentreconstruction:aprospectiverandomizedcomparisonwitha2yearfollowup,Henriksson+rangeofmotiontraininginbracevsplasterimmobilizationafteranteriorcruciateligamentreconstruction:aprospectiverandomizedcomparisonwitha2yearfollowup+2002
238,11973544,[Anterior cruciate ligament reconstruction: patellar tendon autograft versus four-strand hamstring tendon autografts. A comparative study at one year follow-up],"Katabi M, Djian P, Christel P.",Rev Chir Orthop Reparatrice Appar Mot,2002,,Katabi,anteriorcruciateligamentreconstruction:patellartendonautograftversusfourstrandhamstringtendonautograftsacomparativestudyatoneyearfollowup,Katabi+anteriorcruciateligamentreconstruction:patellartendonautograftversusfourstrandhamstringtendonautograftsacomparativestudyatoneyearfollowup+2002
239,11912091,A prospective randomized comparison of patellar tendon versus semitendinosus and gracilis tendon autografts for anterior cruciate ligament reconstruction,"Shaieb MD, Kan DM, Chang SK, Marumoto JM, Richardson AB.",Am J Sports Med,2002,10.1177/03635465020300021201,Shaieb,aprospectiverandomizedcomparisonofpatellartendonversussemitendinosusandgracilistendonautograftsforanteriorcruciateligamentreconstruction,Shaieb+aprospectiverandomizedcomparisonofpatellartendonversussemitendinosusandgracilistendonautograftsforanteriorcruciateligamentreconstruction+2002
240,11877607,Anterior cruciate ligament reconstruction using four-strand semitendinosus and gracilis tendon grafts and metal interference screw fixation,"Colombet P, Allard M, Bousquet V, de Lavigne C, Flurin PH, Lachaud C.",Arthroscopy,2002,10.1053/jars.2002.30637,Colombet,anteriorcruciateligamentreconstructionusingfourstrandsemitendinosusandgracilistendongraftsandmetalinterferencescrewfixation,Colombet+anteriorcruciateligamentreconstructionusingfourstrandsemitendinosusandgracilistendongraftsandmetalinterferencescrewfixation+2002
241,11734484,Four-strand hamstring tendon autograft compared with patellar tendon-bone autograft for anterior cruciate ligament reconstruction. A randomized study with two-year follow-up,"Aune AK, Holm I, Risberg MA, Jensen HK, Steen H.",Am J Sports Med,2001,10.1177/03635465010290060901,Aune,fourstrandhamstringtendonautograftcomparedwithpatellartendonboneautograftforanteriorcruciateligamentreconstructionarandomizedstudywithtwoyearfollowup,Aune+fourstrandhamstringtendonautograftcomparedwithpatellartendonboneautograftforanteriorcruciateligamentreconstructionarandomizedstudywithtwoyearfollowup+2001
242,11685356,Early post-operative morbidity following anterior cruciate ligament reconstruction: patellar tendon versus hamstring graft,"Feller JA, Webster KE, Gavin B.",Knee Surg Sports Traumatol Arthrosc,2001,10.1007/s001670100216,Feller,earlypostoperativemorbidityfollowinganteriorcruciateligamentreconstruction:patellartendonversushamstringgraft,Feller+earlypostoperativemorbidityfollowinganteriorcruciateligamentreconstruction:patellartendonversushamstringgraft+2001
243,11600976,Single- versus bi-socket anterior cruciate ligament reconstruction using autogenous multiple-stranded hamstring tendons with endoButton femoral fixation: A prospective study,"Hamada M, Shino K, Horibe S, Mitsuoka T, Miyama T, Shiozaki Y, Mae T.",Arthroscopy,2001,10.1016/s0749-8063(01)90002-7,Hamada,singleversusbisocketanteriorcruciateligamentreconstructionusingautogenousmultiplestrandedhamstringtendonswithendobuttonfemoralfixation:aprospectivestudy,Hamada+singleversusbisocketanteriorcruciateligamentreconstructionusingautogenousmultiplestrandedhamstringtendonswithendobuttonfemoralfixation:aprospectivestudy+2001
244,11568194,Arthroscopically assisted reconstruction of the anterior cruciate ligament. A follow-up report,O'Neill DB.,J Bone Joint Surg Am,2001,10.2106/00004623-200109000-00006,O'Neill,arthroscopicallyassistedreconstructionoftheanteriorcruciateligamentafollowupreport,O'Neill+arthroscopicallyassistedreconstructionoftheanteriorcruciateligamentafollowupreport+2001
245,11401167,Biodegradable interference screw augmentation reduces tunnel expansion after ACL reconstruction,"Simonian PT, Monson JT, Larson RV.",Am J Knee Surg,2001,,Simonian,biodegradableinterferencescrewaugmentationreducestunnelexpansionafteraclreconstruction,Simonian+biodegradableinterferencescrewaugmentationreducestunnelexpansionafteraclreconstruction+2001
246,11394593,Anterior cruciate ligament reconstruction. A prospective randomized study of three surgical methods,"Anderson AF, Snyder RB, Lipscomb AB Jr.",Am J Sports Med,2001,10.1177/03635465010290030201,Anderson,anteriorcruciateligamentreconstructionaprospectiverandomizedstudyofthreesurgicalmethods,Anderson+anteriorcruciateligamentreconstructionaprospectiverandomizedstudyofthreesurgicalmethods+2001
247,11374431,There are differences in early morbidity after ACL reconstruction when comparing patellar tendon and semitendinosus tendon graft. A prospective randomized study of 107 patients,"Eriksson K, Anderberg P, Hamberg P, Olerud P, Wredmark T.",Scand J Med Sci Sports,2001,,Eriksson,therearedifferencesinearlymorbidityafteraclreconstructionwhencomparingpatellartendonandsemitendinosustendongraftaprospectiverandomizedstudyof107patients,Eriksson+therearedifferencesinearlymorbidityafteraclreconstructionwhencomparingpatellartendonandsemitendinosustendongraftaprospectiverandomizedstudyof107patients+2001
248,11357697,[Semitendinosus tendon vs. patellar ligament. Results of a prospective randomized study after anterior cruciate ligament reconstruction],"Röpke M, Becker R, Urbach D, Nebelung W.",Unfallchirurg,2001,10.1007/s001130050733,Röpke,semitendinosustendonvspatellarligamentresultsofaprospectiverandomizedstudyafteranteriorcruciateligamentreconstruction,Röpke+semitendinosustendonvspatellarligamentresultsofaprospectiverandomizedstudyafteranteriorcruciateligamentreconstruction+2001
249,11341418,A comparison of quadruple semitendinosus and patellar tendon grafts in reconstruction of the anterior cruciate ligament,"Eriksson K, Anderberg P, Hamberg P, Löfgren AC, Bredenberg M, Westman I, Wredmark T.",J Bone Joint Surg Br,2001,10.1302/0301-620x.83b3.11685,Eriksson,acomparisonofquadruplesemitendinosusandpatellartendongraftsinreconstructionoftheanteriorcruciateligament,Eriksson+acomparisonofquadruplesemitendinosusandpatellartendongraftsinreconstructionoftheanteriorcruciateligament+2001
250,11248568,Hamstrings vs. patella tendon for anterior cruciate ligament reconstruction: a randomised controlled trial,"Beard DJ, Anderson JL, Davies S, Price AJ, Dodd CA.",Knee,2001,10.1016/s0968-0160(01)00062-x,Beard,hamstringsvspatellatendonforanteriorcruciateligamentreconstruction:arandomisedcontrolledtrial,Beard+hamstringsvspatellatendonforanteriorcruciateligamentreconstruction:arandomisedcontrolledtrial+2001
251,11147151,Closed kinetic chain alone compared to combined open and closed kinetic chain exercises for quadriceps strengthening after anterior cruciate ligament reconstruction with respect to return to sports: a prospective matched follow-up study,"Mikkelsen C, Werner S, Eriksson E.",Knee Surg Sports Traumatol Arthrosc,2000,10.1007/s001670000143,Mikkelsen,closedkineticchainalonecomparedtocombinedopenandclosedkineticchainexercisesforquadricepsstrengtheningafteranteriorcruciateligamentreconstructionwithrespecttoreturntosports:aprospectivematchedfollowupstudy,Mikkelsen+closedkineticchainalonecomparedtocombinedopenandclosedkineticchainexercisesforquadricepsstrengtheningafteranteriorcruciateligamentreconstructionwithrespecttoreturntosports:aprospectivematchedfollowupstudy+2000
252,11027754,Tunnel expansion after hamstring anterior cruciate ligament reconstruction with 1-incision EndoButton femoral fixation,"Simonian PT, Erickson MS, Larson RV, O'kane JW.",Arthroscopy,2000,10.1053/jars.2000.4635,Simonian,tunnelexpansionafterhamstringanteriorcruciateligamentreconstructionwith1incisionendobuttonfemoralfixation,Simonian+tunnelexpansionafterhamstringanteriorcruciateligamentreconstructionwith1incisionendobuttonfemoralfixation+2000
