J,"Mohtadi, NG; Chan, DS",,,,"Mohtadi, Nicholas G.; Chan, Denise S.",,,"A Randomized Clinical Trial Comparing Patellar Tendon, Hamstring Tendon, and Double-Bundle ACL Reconstructions",JOURNAL OF BONE AND JOINT SURGERY-AMERICAN VOLUME,,,,,,,,,,,,"Background: This randomized clinical trial evaluated the 5-year, disease-specific quality-of-life outcomes of patients treated for anterior cruciate ligament (ACL) deficiency with use of a patellar tendon, single-bundle quadruple-stranded hamstring, or double-bundle hamstring reconstruction. Methods: Patients (n = 110 per group; 183 male; 14 to 50 years of age) were randomly allocated to anatomically positioned ACL reconstruction with use of a patellar tendon graft (patellar tendon group; mean age, 28.7 years), quadruple-stranded hamstring tendon construct (hamstring tendon group; mean age, 28.5 years), or double-bundle hamstring tendon construct (double-bundle group; mean age, 28.3 years). Computer-generated allocation with varied block randomization was performed intraoperatively. The 5-year primary outcome measure was the Anterior Cruciate Ligament-Quality of Life (ACL-QOL) score, and secondary outcome measures included the International Knee Documentation Committee (IKDC) subjective score and objective grades, pivot shift assessment, range of motion, kneeling pain, Tegner activity scale, Cincinnati Occupational Rating Scale, complete traumatic reruptures, partial traumatic tears, total traumatic reinjuries, and atraumatic graft failures. Results: Three hundred and fifteen patients (95%) completed the 5-year follow-up (4 withdrawals, and 11 lost to followup). ACL-QOL scores increased significantly from baseline for all groups (p < 0.0001), but mean scores at 5 years did not differ among the groups (p = 0.548): mean (and standard deviation) of 82.5 +/- 17.9 (95% confidence interval [CI], 79.0 to 86.0) for patellar tendon, 83.9 +/- 18.2 (95% CI, 80.3 to 87.4) for hamstring tendon, and 81.1 +/- 19.3 (95% CI, 77.4 to 84.8) for double-bundle. The proportions of patients at 5 years with a pivot shift grade of >= 2 (12% for patellar tendon, 16% for hamstring tendon, and 22% for double-bundle; p = 0.149) and with normal and nearly normal knees per IKDC grade (87%, 82%, and 75% for the 3 groups, respectively; p = 0.093) trended in favor of patellar tendon reconstruction. No differences were seen for the IKDC subjective scores, knee range of motion including passive extension deficits, the single leg hop test, Cincinnati Occupational Rating scores, and Tegner activity levels. Kneeling pain was more common with patellar tendon reconstruction (10% of patients compared with 4% for hamstring tendon and 2% for double-bundle; p = 0.029). For hamstring tendon and double-bundle reconstructions, there were trends toward more complete traumatic reruptures (4% for patellar tendon, 10% for hamstring tendon, and 10% for double-bundle; p = 0.145) and partial traumatic tears (0%, 5%, and 6%, respectively; p = 0.059), with significantly fewer combined traumatic reinjuries in the patellar tendon group (4 patients compared with 16 for hamstring tendon and 17 for double-bundle; p = 0.010). Atraumatic graft failure (pivot shift grade of >= 2) was found for 10% of the patients. Conclusions: At 5 years, we found no significant difference in the quality-of-life outcome among the patellar tendon, hamstring tendon, and double-bundle techniques for ACL reconstruction. Significantly more patients in the hamstring tendon and double-bundle groups experienced traumatic graft reinjury compared with the patellar tendon group. There was a trend toward a higher percentage with normal and nearly normal IKDC grades in the patellar tendon group compared with hamstring tendon and double-bundle groups.",,,,,,,,,,,,,,,,,,,,,,,,JUN 5,2019,101,11,,,,,949,960,,10.2106/JBJS.18.01322,http://dx.doi.org/10.2106/JBJS.18.01322,,,,,,,,31169571,,,,,WOS:000474366000007,View Full Record in Web of Science
J,"Lu, C; Huang, X",,,,"Lu, Chao; Huang, Xiao",,,"The comparison of clinical efficacy of arthroscopic anterior cruciate ligament reconstruction via autologous bone-patellar tendon-bone, autologous hamstring tendon and allogeneic bone-patellar tendon-bone",INTERNATIONAL JOURNAL OF CLINICAL AND EXPERIMENTAL MEDICINE,,,,,,,,,,,,"Objective: To compare the clinical efficacy of anterior cruciate ligament (ACL) reconstruction via autologous bone-patellar tendon-bone (auBPB), autologous hamstring tendon (auHT) and allogeneic bone-patellar tendon-bone (alBPB) under arthroscope. Methods: One hundred and thirty four cases of patients who accepted ACL reconstruction in our hospital from December 2013 to January 2016 were randomly assigned to three groups: auBPB group (n=40), auHT group (n=59), alBPB group (n=35). The operative time, hospital days, postoperative fever time, Lysholm, Tegner and IKDC knee functional scores at the eighteenth month of follow-up, Lachman test results, pivot-shift test results and the incidence of adverse events of each group were observed and compared. Results: There was no significant difference in general conditions, injury time, stoller grade classification, Lysholm, Tegner and IKDC scores at the eighteenth month of follow-up, the results of Lachman test and pivot-shift test, postoperative average fever time, hospital days, the incidence of postoperative deep venous thrombosis and infection among three groups (all P>0.05). The operative time of alBPB group was significantly shorter than those of the other two groups (P<0.05). The anterior knee pain of auBPB group was significantly more than those of the other two groups (P=0.003 vs. auHT, P=0.029 vs. alBPB). Conclusion: All the reconstruction of ACL via auBPB, auHT and alBPB could achieve positive postoperative knee joint stability, but the incidence of postoperative anterior knee pain after reconstruction of ACL via auBPB was higher.",,,,,,,,,,,,,,,,,,,,,,,,,2017,10,8,,,,,12277,12284,,,,,,,,,,,,,,,,WOS:000408643700110,View Full Record in Web of Science
J,"Boutsiadis, A; Panisset, JC; Devitt, BM; Mauris, F; Barthelemy, R; Barth, J",,,,"Boutsiadis, Achilleas; Panisset, Jean-Claude; Devitt, Brian M.; Mauris, Frederic; Barthelemy, Renaud; Barth, Johannes",,,Anterior Laxity at 2 Years After Anterior Cruciate Ligament Reconstruction Is Comparable When Using Adjustable-Loop Suspensory Fixation and Interference Screw Fixation,AMERICAN JOURNAL OF SPORTS MEDICINE,,,,,,,,,,,,"Background: Adjustable-loop suspensory fixation (ALSF) devices are commonly used in anterior cruciate ligament reconstruction (ACLR). However, concern exists regarding the potential for lengthening under cyclical loads. Purpose: To compare the residual anterior laxity of 2 methods of femoral fixation, ALSF versus interference screw fixation, in patients undergoing isolated ACLR in the absence of meniscal injuries. To determine the preoperative risk factors associated with residual postoperative anterior laxity. Study Design: Cohort study; Level of evidence, 3. Methods: A retrospective analysis was performed comparing 2 groups of patients that underwent primary ACLR using ALSF versus bioabsorbable interference screw fixation. Anterior knee laxity was assessed with Telos stress radiography, while functional outcomes were evaluated with the Knee injury and Osteoarthritis Outcome Score (KOOS) and Tegner activity level scale at a minimum of 2 years postoperatively. A multivariate analysis was performed to identify factors associated with residual postoperative laxity >3 mm. Results: Of the 1136 patients who underwent ACLR during the study period, 363 met the inclusion criteria. A total of 272 patients (75%) (mean age, 31.7 +/- 10.7 years) with a mean follow-up of 25.7 +/- 4.6 months (range, 24-36 months) consented to participate (screw group: n = 121; ALSF group: n = 151). The 2 groups were statistically comparable in terms of age, sex ratio, time from injury to surgery, graft diameter, preoperative laxity, preoperative objective International Knee Documentation Committee (IKDC) grade, and preoperative Tegner score. The mean postoperative laxity as a continuous variable was significantly different comparing the ALSF and screw groups (1.49 +/- 1.98 mm and 2.32 +/- 1.97 mm, respectively; P < .001). In the screw group, 76 patients (62.8%) had normal (<3 mm), 40 (33.1%) had nearly normal (3-6 mm), and 5 (4.1%) had abnormal (>= 6 mm) postoperative knee laxity according to the IKDC grade, while in the ALSF group, 112 patients (74.2%) had normal, 37 (24.5%) had nearly normal, and 2 (1.3%) had abnormal laxity (P = .0833). No significant difference was found in KOOS or Tegner scores comparing the 2 femoral fixation methods: KOOS, 90.6 +/- 7.5 (ALSF group) and 90.6 +/- 7.4 (screw group) (P = .7631), versus Tegner, 6.5 +/- 1.3 (ALSF group) and 6.3 +/- 1.4 (screw group) (P = .2992). A negative correlation was found between postoperative laxity and final Tegner (r(s) = -0.303, P < .001) and KOOS scores (r(s) = -0.168, P = .005). The initial univariate analysis showed differences between groups of patients with residual knee laxity >= 3 mm and <3 mm on preoperative pivot shift, preoperative laxity, age, fixation type, and preoperative objective IKDC grade. The multivariate analysis on these factors showed that the pivot shift remained the only significant predictor for residual laxity >= 3 mm for pivot shift grade 2 compared with grade 1 (odds ratio, 4.689 [95% CI, 2.465-9.286]) and for pivot shift grade 3 compared with grade 1 (odds ratio, 58.025 [95% CI, 12.757-557.741]) (P < .001). Conclusion: For primary ACLR, the use of an ALSF device for femoral fixation is associated with noninferior postoperative anterior knee laxity results compared with interference screw fixation at a minimum 2 years' follow-up. The preoperative pivot shift is the only significant risk factor for postoperative residual anterior knee laxity >3 mm.",,,,,,,,,,,,,,,,,,,,,,,,AUG,2018,46,10,,,,,2366,2375,,10.1177/0363546518784005,http://dx.doi.org/10.1177/0363546518784005,,,,,,,,30015501,,,,,WOS:000440439000007,View Full Record in Web of Science
J,"Porter, M; Shadbolt, B",,,,"Porter, Mark; Shadbolt, Bruce",,,Modified Iliotibial Band Tenodesis Is Indicated to Correct Intraoperative Residual Pivot Shift After Anterior Cruciate Ligament Reconstruction Using an Autologous Hamstring Tendon Graft: A Prospective Randomized Controlled Trial,AMERICAN JOURNAL OF SPORTS MEDICINE,,,,,,,,,,,,"Background: The indications for the addition of anterolateral soft tissue augmentation to anterior cruciate ligament (ACL) reconstruction and its effectiveness remain uncertain. Purpose: To determine if modified iliotibial band tenodesis (MITBT) can improve clinical outcomes and reduce the recurrence of ACL ruptures when added to ACL reconstruction in patients with a residual pivot shift. Study Design: Randomized controlled trial; Level of evidence, 2. Methods: Patients with a primary ACL rupture satisfying the following inclusion criteria were enrolled: first ACL rupture, involved in pivoting sports, skeletally mature, no meniscal repair performed, and residual pivot shift relative to the contralateral uninjured knee immediately after ACL reconstruction. Patients were randomized to group A (no further surgery) or group B (MITBT added) and were followed up for 2 years. The patient-reported outcome (PRO) measures used were the International Knee Documentation Committee (IKDC) score, Knee injury and Osteoarthritis Outcome Score (KOOS) subscale of sport/recreation (Sport/Rec), KOOS subscale of quality of life (QoL), Lysholm knee score (LKS), Tegner activity scale (TAS), recurrent ACL ruptures, or need for further surgery in either knee. Analysis of variance was used to compare PROs; the Wilcoxon test was used for the TAS; and the chi-square test was used for recurrence of ACL ruptures, meniscal injuries, and contralateral ACL ruptures (P < .05). Results: A total of 55 patients were randomized: 27 to group A (female:male ratio = 15:12; mean age, 22.3 +/- 3.7 years) and 28 to group B (female:male ratio = 17:11; mean age, 21.8 +/- 4.1 years). At 2-year follow-up, group A had a similar IKDC score (90.9 +/- 10.7 vs 94.2 +/- 11.2; respectively; P = .21), lower KOOS Sport/Rec score (91.5 +/- 6.4 vs 95.3 +/- 4.4, respectively; P = .02), similar KOOS QoL score (92.0 +/- 4.8 vs 95.1 +/- 4.3, respectively; P = .14), lower LKS score (92.5 +/- 4.8 vs 96.8 +/- 8.0, respectively; P = .004), lower TAS score (median, 7 [range, 7-9] vs 8 [range, 8-10], respectively; P = .03), higher rate of recurrence (14.8% vs 0.0%, respectively; P < .001), similar rate of meniscal tears (14.8% vs 3.6%, respectively; P = .14), and similar rate of contralateral ACL ruptures (3.7% vs 3.6%, respectively; P = .99) relative to group B. Conclusion: The augmentation of ACL reconstruction with MITBT reduced the risk of recurrent ACL ruptures in knees with a residual pivot shift after ACL reconstruction and improved KOOS Sport/Rec, LKS, and TAS scores. Registration: ACTRN12618001043224 (Australian New Zealand Clinical Trials Registry)",,,,,,,,,,,,,,,,,,,,,,,,APR,2020,48,5,,,,,1069,1077,3.63547E+14,10.1177/0363546520910148,http://dx.doi.org/10.1177/0363546520910148,,MAR 2020,,,,,,32182127,,,,,WOS:000523844800001,View Full Record in Web of Science
J,"Dejour, D; Vanconcelos, W; Bonin, N; Saggin, PRF",,,,"Dejour, David; Vanconcelos, Wilson; Bonin, Nicolas; Fernandes Saggin, Paulo Renato",,,"Comparative study between mono-bundle bone-patellar tendon-bone, double-bundle hamstring and mono-bundle bone-patellar tendon-bone combined with a modified Lemaire extra-articular procedure in anterior cruciate ligament reconstruction",INTERNATIONAL ORTHOPAEDICS,,,,,,,,,,,,"The aim of the study was to compare three different procedures performed by the same surgeon: mono-bundle patellar tendon reconstruction (bone-patellar tendon-bone, BPTB), double-bundle hamstring reconstruction (DBH) and mono-bundle patellar tendon combined with extra-articular reconstruction (Lemaire) (BPTB + L). A total of 75 patients (25 in each group) were evaluated at a mean follow-up of 25 months. Laxity was assessed pre- and post-operatively with Telos (TM) stress radiographs (15 kg). The amount of anterior tibial translation (ATT) corrected by the surgery was quantified. Secondary outcomes were International Knee Documentation Committee (IKDC) scores, pivot shift grading, pain complaints, sensory deficits, subsequent surgical procedures, return to sports and patients' ability to kneel or squat on their affected knee. Absolute correction of ATT for the internal compartment was not statistically significant [analysis of variance (ANOVA), p = 0.377]. For the external compartment BPTB + L (8.2 mm) showed superiority over DBH (5.6 mm) and BPTB (4.1 mm) (ANOVA, p = 0.0001, Tukey's test). Kneeling was better in the DBH group (ANOVA, p = 0.0001, Tukey's test). In 22 patients it felt normal, while only in seven in the BPTB and eight in the BPTB + L groups. Sensory deficits were present in 11 patients from the DBH group, while in 17 in the BPTB and 19 in the BPTB + L groups (ANOVA, p = 0.052). Mean IKDC values, presence of anterior knee pain, subsequent operations, ability to squat and return to sports were not statistically different between groups. Absolute correction of ATT was not statistically different for the medial compartment, but the patellar tendon reconstruction combined with the extra-articular procedure achieved the best lateral compartment ATT correction. Sensory deficits and kneeling seem to be worse in the groups where the patellar tendon is harvested.",,,,,,,,,,,,,,,,,,,,,,,,FEB,2013,37,2,,,,,193,199,,10.1007/s00264-012-1718-z,http://dx.doi.org/10.1007/s00264-012-1718-z,,,,,,,,23180103,,,,,WOS:000314297200004,View Full Record in Web of Science
J,"Sacramento, SN; Magalhaes, E; Christel, P; Ingham, S; Fukuda, TY",,,,"Sacramento, Sylvio Noronha; Magalhaes, Eduardo; Christel, Pascal; Ingham, Sheila; Fukuda, Thiago Yukio",,,A new technique in double-bundle anterior cruciate ligament reconstruction with implant-free tibial fixation,KNEE SURGERY SPORTS TRAUMATOLOGY ARTHROSCOPY,,,,,,,,,,,,"This case-series outcome study presents a surgical technique for anatomic double-bundle anterior cruciate ligament (ACL) reconstruction with 4-tunnel using two interference screws. There was a 2-year minimum follow-up. From January to December 2009, an ACL 4-tunnel, anatomic, double-bundle reconstruction was performed on 27 patients. Double-strand hamstring tendon grafts were used in each femoral tunnel as well as two interference screws. Tibial fixation was insured through manual tension, by tying non-absorbable sutures on the bone bridge between the two tunnels at 20A degrees of knee flexion. Clinical assessments included the International Knee Documentation Committee (IKDC) and Lysholm knee scores, range of motion (ROM), pivot-shift test, single-leg hop, and quadriceps-hamstrings strength tests using a hand-held dynamometer. Anterior knee laxity was also assessed using a rolimeter. A single examiner performed all testing pre-operatively at 6 months and during the 2-year follow-up. All patients were assessed during the 2-year follow-up. At that time, 92 % of the patients presented normal anterior laxity (average, 1.3 +/- 0.5 mm) and rotational knee stability. No statistical side-to-side difference was found for ROM, muscle strength, single-leg hop, and function (n.s.). All patients presented a normal knee function according to the IKDC and the Lysholm score. In addition, no infection, graft failure, or pain were observed at the harvesting site. The study shows that satisfactory results in relation to knee laxity, function, and strength can be achieved with the implant-free tibial fixation in the ACL double-bundle reconstruction with two interference screws. Therapeutic case series, Level IV.",,,,,,,,,,,,,,,,,,,,,,,,SEP,2016,24,9,,,,,2831,2837,,10.1007/s00167-014-3430-6,http://dx.doi.org/10.1007/s00167-014-3430-6,,,,,,,,25630275,,,,,WOS:000382106000020,View Full Record in Web of Science
J,"Elveos, MM; Drogset, JO; Engebretsen, L; Bronn, R; Lundemo, TO; Gifstad, T",,,,"Elveos, Marlene Mauseth; Drogset, Jon Olav; Engebretsen, Lars; Bronn, Raymond; Lundemo, Trond Olav; Gifstad, Tone",,,Anterior Cruciate Ligament Reconstruction Using a Bone-Patellar Tendon-Bone Graft With and Without a Ligament Augmentation Device: A 25-Year Follow-up of a Prospective Randomized Controlled Trial,ORTHOPAEDIC JOURNAL OF SPORTS MEDICINE,,,,,,,,,,,,"Background: Various grafts and ligament augmentation devices (LADs) have been used in the search for optimal reconstruction of the anterior cruciate ligament (ACL). Purpose: To compare 25-year follow-up results after ACL reconstruction using a bone-patellar tendon-bone (BPTB) graft with or without the Kennedy LAD. Study Design: Randomized controlled trial; Level of evidence, 1. Methods: One hundred patients undergoing ACL reconstruction between 1991 and 1993 were randomized into 2 groups: reconstruction using a BPTB graft alone (BPTB group, 51 patients) or a BPTB graft with the Kennedy LAD (LAD group, 49 patients). The 25-year follow-up evaluation included a clinical knee examination, patient-reported outcome measures, and an assessment of radiological osteoarthritis (OA) according to the Ahlback classification. Additional outcomes were reruptures and knee arthroplasty. Results: Ninety-three patients (93%) were available for the follow-up evaluation: 48 patients in the BPTB group and 45 in the LAD group. Through telephone calls, 26 patients were excluded from further investigation because of reruptures and arthroplasty in the knee of interest; 67 patients were further investigated. A total of 43 of 44 (98%) and 42 of 44 (95%) patients had negative or 1+ Lachman and pivot-shift test results, respectively. The mean Lysholm score was 85 for the BPTB group and 83 for the LAD group. All mean Knee injury and Osteoarthritis Outcome Score (KOOS) subscale values were >= 73. There were no statistically significant differences between groups in any of these outcomes or regarding the Tegner score, radiological classification of OA, or number of ACL reruptures. Signs of radiological OA were detected in all patients, and severe radiological OA (Ahlback grade III, IV, or V) was detected in 32% of patients in the BPTB group and 21% of patients in the LAD group (P = .37). There were 12 patients in the BPTB group and 7 in the LAD group who had documented reruptures (P = .40). One patient in the BPTB group and 6 in the LAD group underwent knee arthroplasty (P = .054). Conclusion: In the present study, there were no statistically significant differences between groups in any of the outcomes. After 25 years, 19% of patients had reruptures, 27% had severe radiological OA, and 7% underwent knee arthroplasty.",,,,,,,,,,,,,,,,,,,,,,,,NOV 20,2018,6,11,,,,,,,2.32597E+15,10.1177/2325967118808778,http://dx.doi.org/10.1177/2325967118808778,,,,,,,,30480022,,,,,WOS:000451260900001,View Full Record in Web of Science
J,"Taylor, DC; DeBerardino, TM; Nelson, BJ; Duffey, M; Tenuta, J; Stoneman, PD; Sturdivant, RX; Mountcastle, S",,,,"Taylor, Dean C.; DeBerardino, Thomas M.; Nelson, Bradley J.; Duffey, Michele; Tenuta, Joachim; Stoneman, Paul D.; Sturdivant, Rodney X.; Mountcastle, Sally",,,Patellar Tendon Versus Hamstring Tendon Autografts for Anterior Cruciate Ligament Reconstruction A Randomized Controlled Trial Using Similar Femoral and Tibial Fixation Methods,AMERICAN JOURNAL OF SPORTS MEDICINE,,,,,,,,,,,,"Background: Controversy remains over the most appropriate graft for anterior cruciate ligament reconstruction. Hypothesis: There is no significant difference in outcomes after 4-strand hamstring and patellar tendon autograft anterior cruciate ligament reconstructions using similar fixation techniques. Study Design: Randomized controlled trial; Level of evidence, 1. Methods: Between August 2000 and May 2003, 64 Keller Army Hospital patients with complete anterior cruciate ligament tears were randomized to hamstring (n = 32) or patellar tendon (n = 32) autograft anterior cruciate ligament reconstruction. Operative graft fixation and rehabilitative techniques were the same for both groups. Follow-up assessments included the Single Assessment Numeric Evaluation score, Lysholm score, International Knee Documentation Committee score, and Knee Injury and Osteoarthritis Outcome Score. Postoperative radiographs were analyzed for tunnel location and orientation. Results: Eleven women and 53 men were randomized. Eighty-three percent of the patients (53 of 64) had follow-up of greater than 2 years, or to the point of graft rupture or removal (average follow-up, 36 months). Four hamstring grafts (12.5%) and three patellar tendon grafts (9.4%) (P=.71) ruptured. One deep infection in a hamstring graft patient necessitated graft removal. Forty-five of the 56 patients with intact grafts had greater than 2-year follow-up. Patients with patellar tendon grafts had greater Tegner activity scores (P=.04). Single Assessment Numeric Evaluation scores were 88.5 (95% confidence interval: 83.1, 93.8) and 90.1 (95% confidence interval: 85.2, 96.1) for the hamstring and patellar tendon groups, respectively (P=.53). Lysholm scores were 90.3 (95% confidence interval: 84.4, 96.1) and 90.4 (95% confidence interval: 84.5, 96.3) for the hamstring and patellar tendon groups, respectively (P=.97). There were no significant differences in knee laxity, kneeling pain, isokinetic peak torque, International Knee Documentation Committee score, or Knee Injury and Osteoarthritis Outcome Scores. Postoperative graft rupture correlated with more horizontal tibial tunnel orientation. Conclusion: Hamstring and patellar tendon autografts provide similar objective, subjective, and functional outcomes when assessed at least 2 years after anterior cruciate ligament reconstruction.",,,,,,,,,,,,,,,,,,,,,,,,OCT,2009,37,10,,,,,1946,1957,,10.1177/0363546509339577,http://dx.doi.org/10.1177/0363546509339577,,,,,,,,19684298,,,,,WOS:000270272700007,View Full Record in Web of Science
