J,"Lecoq, FA; Parienti, JJ; Murison, J; Ruiz, N; Bouacida, K; Besse, J; Morin, V; Padiolleau, G; Cucurulo, T; Graveleau, N; Hulet, C",,,,"Lecoq, Flore-Anne; Parienti, Jean-Jacques; Murison, James; Ruiz, Nicolas; Bouacida, Khaled; Besse, Jeremy; Morin, Vincent; Padiolleau, Giovany; Cucurulo, Thomas; Graveleau, Nicolas; Hulet, Christophe",,Soc Francaise Chirurg Orthopedique,Graft Choice and the Incidence of Osteoarthritis After Anterior Cruciate Ligament Reconstruction A Causal Analysis From a Cohort of 541 Patients,AMERICAN JOURNAL OF SPORTS MEDICINE,,,,,,,,,,,,"Background: Anterior cruciate ligament (ACL) reconstruction is important to prevent knee osteoarthritis. Neither of the 2 most common graft techniques-the patellar tendon (PT) or hamstring tendon (HS) graft-has demonstrated superiority in terms of the long-term osteoarthritis rate. Hypothesis: Based on the International Knee Documentation Committee (IKDC) radiographic grading system, PT grafts decrease the incidence of osteoarthritis by providing better knee stability as compared with HS grafts over 12 years of follow-up. Study Design: Cohort study; Level of evidence, 3. Methods: All adults with a first ACL rupture who underwent surgery with a PT or HS graft technique between January 2002 and December 2003 were included in the 2014 French Society of Orthopedic Surgery and Traumatology Symposium database. Baseline characteristics were collected. The primary endpoint was the occurrence of moderate to severe osteoarthritis in each group. The secondary endpoints included clinical subjective evaluations by the IKDC score and Knee injury and Osteoarthritis Outcome Score. To control the differences in baseline characteristics, the data were analyzed with propensity score matching. Results: In the cohort, 541 patients from 18 centers were included: 311 PT and 230 HS ACL reconstructions. The baseline characteristics were similar after inverse probability weighting treatment (IPWT). The occurrence of osteoarthritis was similar after IPWT (19.3% for PT and 19.6% for HS, P = .94). Age at surgery >29 years and IKDC osteoarthritis stage B at the index surgery were identified as risk factors for moderate to severe osteoarthritis. Most functional outcomes were significantly higher in the HS group; however, the difference between groups remained <10 points. Of the 106 patients who needed a medial meniscectomy, the proportion of patients with moderate to severe osteoarthritis was much higher in the HS group (43.5% vs 18.3%, P = .006). However, after IPWT, the difference was not statistically significant. Conclusion: At 12 years of follow-up, neither graft technique was superior to the other in terms of the rate of osteoarthritis.",,,,,,,,,,,,,,,,,,,,,,,,OCT,2018,46,12,,,,,2842,2850,,10.1177/0363546518795137,http://dx.doi.org/10.1177/0363546518795137,,,,,,,,30199646,,,,,WOS:000446347200008,View Full Record in Web of Science
J,"McRae, S; Leiter, J; McCormack, R; Old, J; MacDonald, P",,,,"McRae, Sheila; Leiter, Jeff; McCormack, Robert; Old, Jason; MacDonald, Peter",,,Ipsilateral Versus Contralateral Hamstring Grafts in Anterior Cruciate Ligament Reconstruction A Prospective Randomized Trial,AMERICAN JOURNAL OF SPORTS MEDICINE,,,,,,,,,,,,"Background: Benefits of graft harvest from the side contralateral to the anterior cruciate ligament (ACL)-deficient leg have been identified when using bone-patellar tendon-bone autografts in ACL reconstruction (ACLR). As hamstring tendon autografts are becoming more commonly used, a study examining the effect of contralateral graft harvest of semitendinosus gracilis (STG) tendons on patient quality of life was conducted. Purpose: To evaluate if ACLR using a hamstring tendon autograft results in better patient quality of life if the graft is harvested from the leg contralateral to the ACL rupture compared with the ipsilateral leg. Study Design: Randomized controlled trial; Level of evidence, 1. Methods: A total of 100 participants between 16 and 50 years of age with a complete ACL tear were randomly assigned to undergo ACLR using either the ipsilateral or contralateral leg as the STG graft donor. Primary outcome measures were the ACL Quality of Life questionnaire (ACL-QOL), concentric knee flexion and extension strength at 60 and 240 deg/s, International Knee Documentation Committee (IKDC) knee assessment form, early postoperative pain and diary of analgesic use, and rate of reruptures. Outcome measures were evaluated before surgery and at 3, 6, 12, and 24 months after surgery. Results: The ACL-QOL score improved over time for both groups (P < .001), and there were no significant differences between groups at any time point (P = .528). Significant differences in knee flexion and extension strength were found at 3 months after surgery. There were no differences between groups in IKDC knee assessment scores or rerupture rates. Conclusion: There does not appear to be any measurable benefit or drawback in quality of life to the use of an STG graft from the unaffected limb. In light of this finding, further research to examine other possible effects on agility and balance as well as time and ability to return to sport should be conducted. Longer term follow-up beyond 2 years would allow for a more thorough evaluation of the risk of reruptures or contralateral reruptures using this novel approach.",,,,,,,,,,,,,,,,,,,,,,,,NOV,2013,41,11,,,,,2492,2499,,10.1177/0363546513499140,http://dx.doi.org/10.1177/0363546513499140,,,,,,,,24001575,,,,,WOS:000326453500005,View Full Record in Web of Science
J,"Sinding, KS; Nielsen, TG; Hvid, LG; Lind, M; Dalgas, U",,,,"Sinding, Kasper Staghoj; Nielsen, Torsten Gronbech; Hvid, Lars Grondahl; Lind, Martin; Dalgas, Ulrik",,,Effects of Autograft Types on Muscle Strength and Functional Capacity in Patients Having Anterior Cruciate Ligament Reconstruction: A Randomized Controlled Trial,SPORTS MEDICINE,,,,,,,,,,,,"Background The effects of different autograft types for anterior cruciate ligament reconstruction (ACL-R) on muscle function are sparsely investigated in randomized controlled trials. Our aim was to investigate the effects of quadriceps tendon autograft (QTB) vs. semitendinosus-gracilis autograft (StG) on thigh muscle strength and functional capacity, and a patient-reported outcome 1 year after ACL-R, and to compare the results to healthy controls. Methods ACL-R patients (n = 100) and matched controls (CON, n = 50) were recruited, with patients being randomly assigned to QTB (n = 50) or StG (n = 50) ACL-R. One year after ACL-R, bilateral knee extensor (KE) and flexor (KF) muscle strength (isometric, dynamic, explosive, limb symmetry index [LSI], hamstring:quadriceps ratio [HQ ratio]) were assessed by isokinetic dynamometry, along with functional capacity (single leg hop distance [SHD]) and a patient-reported outcome (International Knee Documentation Committee [IKDC] score). Results KE muscle strength of the operated leg was lower (9-11%) in QTB vs. StG as was KE LSI, while KF muscle strength was lower (12-17%) in StG vs. QTB as was KF LSI. HQ ratios were lower in StG vs. QTB. Compared with the controls, KE and KF muscle strength were lower in StG (10-22%), while KE muscle strength only was lower in QTB (16-25%). Muscle strength in the StG, QTB, and CON groups was identical in the non-operated leg. While SHD and IKDC did not differ between StG and QTB, SHD in both StG and QTB was lower than CON. The IKDC scores improved significantly 1 year following ACL-R for both graft types. Conclusion One year after ACL-R, muscle strength is affected by autograft type, with StG leading to impairments of KE and KF muscle strength, while QTB results in more pronounced impairments of KE only. Functional capacity and patient-reported outcome were unaffected by autograft type, with the former showing impairment compared to healthy controls.",,,,,,,,,,,,,,,,,,,,,,,,JUL,2020,50,7,,,,,1393,1403,,10.1007/s40279-020-01276-x,http://dx.doi.org/10.1007/s40279-020-01276-x,,MAR 2020,,,,,,32125668,,,,,WOS:000518056700003,View Full Record in Web of Science
J,"López-Vidriero, E; Olivé-Vilas, R; López-Capapé, D; Varela-Sende, L; López-Vidriero, R; Til-Pérez, L",,,,"Lopez-Vidriero, Emilio; Olive-Vilas, Ramon; Lopez-Capape, David; Varela-Sende, Luisa; Lopez-Vidriero, Rosa; Til-Perez, Luis",,,"Efficacy and Tolerability of Progen, a Nutritional Supplement Based on Innovative Plasma Proteins, in ACL Reconstruction: A Multicenter Randomized Controlled Trial",ORTHOPAEDIC JOURNAL OF SPORTS MEDICINE,,,,,,,,,,,,"Background: New biologic strategies are arising to enhance healing and improve the clinical outcome of anterior cruciate ligament (ACL) reconstruction. Purpose: To evaluate the efficacy of a new oral nutritional supplement (Progen) that contains hydrolyzed collagen peptides and plasma proteins, a hyaluronic acid-chondroitin sulfate complex, and vitamin C. Study Design: Randomized controlled trial; Level of evidence, 2. Methods: The study included patients who underwent ACL reconstruction with hamstring autografts using the same fixation method. All patients received the same analgesia and physical therapy (PT) protocol and were randomized to receive either the nutritional supplement (supplemented group) or no additional therapy (control group). Patients were followed up at days 7, 30, 60, and 90. Pain was assessed by use of a visual analog scale (VAS) and by analgesic consumption. Clinical outcome was assessed via International Knee Documentation Committee (IKDC) score and the number of PT sessions. Perceived efficacy and tolerability were rated on a 5-point Likert scale. Graft maturation was assessed by a blinded musculoskeletal radiologist using magnetic resonance imaging. The number of adverse events (AEs) was recorded. Results: The intention-to-treat analysis included 72 patients, 36 allocated to the supplemented group and 36 to the control group, with no significant differences regarding demographic and preoperative characteristics. Both groups showed significant improvement in pain and function (measured by VAS and IKDC scores) during the 90-day follow-up period (P < .001 for both), without significant differences between groups. The supplemented group had fewer patients that needed analgesics (8.5% vs 50.0%; P < .05) and attended fewer PT sessions (38.0 vs 48.4 sessions; P < .001) at 90 days and had a higher IKDC score at 60 days (62.5 vs 55.5; P = .029) compared with the control group. Patient- and physician-perceived efficacy was considered significantly higher in the supplemented group at 60 and 90 days (P < .05). Perceived tolerability of the overall intervention was better in the supplemented group at 30, 60, and 90 days (P < .05). Graft maturation showed more advanced degrees (grades 3 and 4) in the supplemented group at 90 days (61.8% vs 38.2%; P < .01). No intolerance or AEs associated with the nutritional supplement treatment were reported. Conclusion: The combination of the nutritional supplement and PT after ACL reconstruction improved pain, clinical outcome, and graft maturation. Nutritional supplementation showed higher efficacy during the second month of recovery, without causing AEs. Registration: NCT03355651 ( identifier).",,,,,,,,,,,,,,,,,,,,,,,,FEB 27,2019,7,2,,,,,,,2.32597E+15,10.1177/2325967119827237,http://dx.doi.org/10.1177/2325967119827237,,,,,,,,30834280,,,,,WOS:000460006700001,View Full Record in Web of Science
J,"Fleming, BC; Fadale, PD; Hulstyn, MJ; Shalvoy, RM; Oksendahl, HL; Badger, GJ; Tung, GA",,,,"Fleming, Braden C.; Fadale, Paul D.; Hulstyn, Michael J.; Shalvoy, Robert M.; Oksendahl, Heidi L.; Badger, Gary J.; Tung, Glenn A.",,,The Effect of Initial Graft Tension After Anterior Cruciate Ligament Reconstruction A Randomized Clinical Trial With 36-Month Follow-up,AMERICAN JOURNAL OF SPORTS MEDICINE,,,,,,,,,,,,"Background: The initial graft tension applied at the time of anterior cruciate ligament (ACL) reconstruction alters joint contact and may influence cartilage health. The objective was to compare outcomes between 2 commonly used laxity-based initial graft tension protocols. Hypotheses: (1) The high-tension group would have less knee laxity, improved clinical and patient-oriented outcomes, and less cartilage damage than would the low-tension group after 36 months of healing. (2) The outcomes of the high-tension group would be equivalent to those of a matched control group. Study Design: Randomized controlled trial; Level of evidence, 1. Methods: Ninety patients with isolated unilateral ACL injuries were randomized to undergo ACL reconstruction using 1 of 2 initial graft tension protocols: (1) autografts tensioned to restore normal anterior-posterior (AP) laxity at the time of surgery (ie, low tension; n = 46) and (2) autografts tensioned to overconstrain AP laxity by 2 mm (ie, high tension; n = 44). Sixty matched healthy patients formed the control group. Outcomes were assessed preoperatively, intraoperatively, and at 6, 12, and 36 months after surgery. Results: No significant differences were found between the 2 initial graft tension protocols for any of the outcome measures at 36 months. However, there were differences when comparing the 2 treatment groups to the control group. On average, AP laxity was 2 mm greater in the ACL-reconstructed groups than in the control group (P < .007). International Knee Documentation Committee (IKDC) knee evaluation scores, peak isokinetic knee extension torques, and 4 of 5 Knee Osteoarthritis Outcome Scores (KOOS) were significantly worse than the control group (P < .001, P < .027, and P < .05, respectively). Short Form-36 Health Survey (SF-36) scores and reinjury rates were similar between groups at 36 months. Although there were significant changes in radiography and magnetic resonance imaging present in the ACL-reconstructed knees of both treatment groups, the magnitude was relatively small and likely clinically insignificant at 36 months. Conclusion: Both laxity-based initial graft tension protocols produced similar outcomes without fully restoring joint function or patient-oriented outcomes (KOOS) when compared with the control group. There was minimal evidence of cartilage damage 36 months after surgery.",,,,,,,,,,,,,,,,,,,,,,,,JAN,2013,41,1,,,,,25,34,,10.1177/0363546512464200,http://dx.doi.org/10.1177/0363546512464200,,,,,,,,23144370,,,,,WOS:000313008300004,View Full Record in Web of Science
J,"Shumborski, S; Heath, E; Salmon, LJ; Roe, JP; Linklater, JP; Facek, M; Pinczewski, LA",,,,"Shumborski, Sarah; Heath, Emma; Salmon, Lucy J.; Roe, Justin P.; Linklater, James P.; Facek, Michael; Pinczewski, Leo A.",,,A Randomized Controlled Trial of PEEK Versus Titanium Interference Screws for Anterior Cruciate Ligament Reconstruction With 2-Year Follow-up,AMERICAN JOURNAL OF SPORTS MEDICINE,,,,,,,,,,,,"Background: Graft fixation with interference screws for anterior cruciate ligament (ACL) reconstruction is a highly successful technique. Polyether ether ketone (PEEK) is a novel thermoplastic polymer with high biocompatibility and mechanical properties that mimic native bone, and it can be imaged on computed tomography or magnetic resonance imaging (MRI) without signal flare. Purpose: To compare the clinical performance of ACL reconstruction with PEEK and titanium interference screws at 2 years and to evaluate a novel method of measuring tunnel volume. Study Design: Randomized controlled trial; Level of evidence, 1. Methods: A total of 133 patients underwent arthroscopic ACL reconstruction with 4-strand hamstring autografts and were randomized to have titanium or PEEK interference screws for femoral and tibial tunnel fixation. At 2 years, subjective Lysholm and International Knee Documentation Committee scores were assessed and clinical examination performed. At 12 months, MRI was performed to assess graft incorporation and cyst formation, and a novel technique was employed to measure tunnel volumes. Results: There were no significant differences in graft rerupture rate, contralateral ACL rupture rate, subjective outcomes, or objective outcomes. In the titanium and PEEK groups, MRI demonstrated high overall rates of graft integration (96%-100% and 90%-93%, respectively) and ligamentization (89% and 84%) and low rates of synovitis (22% and 10%) and cyst formation (0%-18% and 13%-15%). There was a higher proportion of patients with incomplete graft integration within the femoral tunnel in the PEEK group as compared with the titanium group (10% vs 0%, P = .03); however, the authors suggest that metal artifact precluded proper assessment of the graft in the titanium group by MRI. Tunnel volumes also appeared to be equivalent in the 2 groups and were measured with a novel technique that was highly reproducible in the PEEK group secondary to the absence of flare. Conclusion: Two-year clinical analysis of PEEK interference screws for femoral and tibial fixation of ACL reconstructions showed equivalent clinical performance to titanium interference screws. Given the excellent mechanical characteristics, biological compatibility, and absence of metal artifact on MRI, PEEK has become our material of choice for interference screw fixation in ACL reconstruction.",,,,,,,,,,,,,,,,,,,,,,,,AUG,2019,47,10,,,,,2386,2393,,10.1177/0363546519861530,http://dx.doi.org/10.1177/0363546519861530,,,,,,,,31306589,,,,,WOS:000478659700016,View Full Record in Web of Science
J,"Vicente-Mampel, J; López-Soler, J; Sevilla-López, P; Ferrer-Torregrosa, J; Martín-Ruíz, J; Jaenada-Carrilero, E; Castillo-Dutor, N; Pascual-Leone, A; Pascual-Leone, N; Baraja-Vegas, L; Muñoz, JMT",,,,"Vicente-Mampel, J.; Lopez-Soler, J.; Sevilla-Lopez, P.; Ferrer-Torregrosa, J.; Martin-Ruiz, J.; Jaenada-Carrilero, E.; Castillo-Dutor, N.; Pascual-Leone, A.; Pascual-Leone, N.; Baraja-Vegas, L.; Tormos Munoz, J. M.",,,Enhancing functional recovery after ACL injury. A protocol for a randomized control trial of transcranial direct current stimulation over the motor cortex,FRONTIERS IN REHABILITATION SCIENCES,,,,,,,,,,,,"Introduction Anterior cruciate ligament (ACL) tears are common in athletic and nonathletic populations, often resulting from activities involving rapid directional changes that place stress on the knee. Although advances in surgery and rehabilitation have improved recovery, many patients still struggle to regain pre-injury performance and face increased risk of re-injury. We hypothesize that combining standard rehabilitation with transcranial direct current stimulation (tDCS) may accelerate recovery, improve neuromuscular control, and strengthen key muscles like the hamstrings and hip abductors, reducing reinjury risk. Methods/materials This randomized controlled trial protocol, approved by the Ethics Committee of the Catholic University of Valencia, follows a double-blind, comparative, longitudinal design per SPIRIT guidelines. Elite athletes will be randomized 1:1 into two age- and sex-matched groups: non-invasive brain stimulation (NIBS) + rehabilitation (ProtocolRHB) or sham NIBS + ProtocolRHB. The NIBS intervention uses tDCS to deliver low-intensity direct current to modulate cortical excitability. Data collection spans April 2025 to December 2027 with outcomes assessed at four postsurgical time points. The primary outcome is electromyographic (EMG) activity to evaluate muscle activation, crucial for restoring knee stability and function. Secondary outcomes include knee function (Lysholm Scale) and ACL-specific quality of life. EEG and TMS will assess cortical excitability and plasticity during voluntary muscle contraction. Impact statement This study integrates neurophysiology with rehabilitation, offering a novel approach to enhance functional recovery and lower reinjury risk post-ACL reconstruction, potentially informing future evidence-based sports medicine and neurorehabilitation strategies.",,,,,,,,,,,,,,,,,,,,,,,,OCT 16,2025,6,,,,,,,,1627228,10.3389/fresc.2025.1627228,http://dx.doi.org/10.3389/fresc.2025.1627228,,,,,,,,41180415,,,,,WOS:001605627700001,View Full Record in Web of Science
J,"Costa, MQ; Badger, GJ; Chrostek, CA; Carvalho, OD; Faiola, SL; Fadale, PD; Hulstyn, MJ; Gil, HC; Shalvoy, RM; Fleming, BC",,,,"Costa, Meggin Q.; Badger, Gary J.; Chrostek, Cynthia A.; Carvalho, Orianna D.; Faiola, Stacy L.; Fadale, Paul D.; Hulstyn, Michael J.; Gil, Holly C.; Shalvoy, Robert M.; Fleming, Braden C.",,,Effects of Initial Graft Tension and Patient Sex on Knee Osteoarthritis Outcomes After ACL Reconstruction: A Randomized Controlled Clinical Trial With 10-to 12-Year Follow-up,AMERICAN JOURNAL OF SPORTS MEDICINE,,,,,,,,,,,,"Background: The initial graft tension applied during anterior cruciate ligament (ACL) graft fixation may promote posttraumatic osteoarthritis (PTOA). Purpose/Hypothesis: This study sought to assess the effect of initial graft tension and patient sex on PTOA outcomes at 10 to 12 years after ACL reconstruction (ACLR). The hypothesis was that there would be no group- or sex-based differences in outcomes. Study Design: Randomized controlled trial; Level of evidence, 1. Methods: Patients were randomized to receive ACLR with a low or high initial graft tension. Outcomes were evaluated at 10 to 12 years postoperatively and compared with a matched, uninjured control group. Outcomes included clinical assessments (anteroposterior [AP] knee laxity measurement, International Knee Documentation Committee [IKDC] examination score), a functional assessment (single-leg hop for distance), patient-reported outcomes (Knee injury and Osteoarthritis Outcome Score [KOOS], 36-Item Short Form Health Survey, Tegner activity level, patient satisfaction), and PTOA imaging (Osteoarthritis Research Society International [OARSI] radiographic score and Whole-Organ Magnetic Resonance Imaging Score [WORMS]). Two-way mixed-model analyses of variance were used to evaluate differences in outcomes between tension groups and the control group and between female and male patients. Results: Both tension groups scored worse than the control group for the IKDC examination (P <= .021), KOOS (Pain, Activities of Daily Living, Sport/Recreation, and Quality of Life subscales) (P <= .049), and WORMS difference score (P <= .042). The low-tension group scored worse than the control group for KOOS Symptoms (P = .016) and the OARSI difference score (P = .015). The index limb had worse scores than the contralateral limb within the high-tension group for AP laxity (P = .030) and hop deficit (P = .011). This result was also observed within both tension groups for the WORMS (P <= .050) and within the low-tension group for the OARSI score (P = .001). Male patients had higher Tegner scores (mean +/- SE) relative to female patients (male, 5.49 +/- 1.88; female, 4.45 +/- 1.65) and worse OARSI difference scores (male, 1.89 +/- 5.38; female, 0.244 +/- 0.668) (P = .007 and .034, respectively). However, no significant differences were detected between tension groups for any of the outcomes measured. Conclusion: Overall, ACLR failed to prevent PTOA regardless of initial graft tension. However, male patients treated with a low initial graft tension may be at greater risk for PTOA. These results do not support the hypothesis of no sex differences in outcomes at 10 to 12 years after ACLR.",,,,,,,,,,,,,,,,,,,,,,,,NOV,2022,50,13,,,,,3510,3521,,10.1177/03635465221124917,http://dx.doi.org/10.1177/03635465221124917,,OCT 2022,,,,,,36259724,,,,,WOS:000870452700001,View Full Record in Web of Science
