J,"Fauno, P; Kaalund, S",,,,"Fauno, P; Kaalund, S",,,Tunnel widening after hamstring anterior cruciate ligament reconstruction is influenced by the type of graft fixation used: A prospective randomized study,ARTHROSCOPY-THE JOURNAL OF ARTHROSCOPIC AND RELATED SURGERY,,,,,,,,,,,,"Purpose: To compare the incidence of tunnel widening (TW) in patients undergoing anterior cruciate ligament (ACL) reconstruction with hamstring graft using either (group A) transfemoral fixation implant (Transfix; Arthrex, Naples, FL) and an interference screw (Arthrex) in the tibial tunnel or (group B) extracortical fixation (EndoButton; Smith & Nephew Endoscopy, Andover, MA) in the femur and bicortical screw and washer distal to the tibial tunnel. Type of Study: Prospective randomized study. Methods: One hundred patients were included and randomized and 87 patients were assessed at a 1-year follow-up. The evaluation included standardized radiographs, KT-1000 data, International Knee Documentation Committee (IKDC) ratings, and Lysholm score. The diameter of the tunnel at the 1 year follow-up was, after correction for magnification, compared with the tunnel diameter of the radiograph from 2 weeks postoperatively. A more than 2-mm enlargement was considered TW. Results: In group A in which transfixation in the femur and interference screw in the tibia was used, 7 of 41 patients had developed femoral TW and 5 of 41 tibial TW. In group B, 20 of 46 patients had TW in the femur and 16 of 46 in the tibia (P <.05, chi-square test). No significant difference was found with respect to Lysholm score, IKDC, or arthrometric evaluation. Conclusions: There was a significant reduction of TW in both the femur and the tibia using fixation points close to the joint, compared with the system where the distance between the fixation points is long. We conclude that the position of the fixation sites and type of fixation device are major factors in the development of TW after ACL surgery. Level of Evidence: Level I, therapeutic study in a prospective randomized clinical trial.",,,,,,,,,,,,,,,,,,,,,,,,NOV,2005,21,11,,,,,1337,1341,,10.1016/j.arthro.2005.08.023,http://dx.doi.org/10.1016/j.arthro.2005.08.023,,,,,,,,16325084,,,,,WOS:000233885600008,View Full Record in Web of Science
J,"Zhao, JH; He, YH; Wang, JH",,,,"Zhao, Jinzhong; He, Yaohua; Wang, Jianhua",,,Double-bundle anterior cruciate ligament reconstruction: Four versus eight strands of hamstring tendon graft,ARTHROSCOPY-THE JOURNAL OF ARTHROSCOPIC AND RELATED SURGERY,,,,,,,,,,,,"Purpose: The purpose of this study was to compare the clinical results of a double-bundle anterior cruciate ligament (ACL) reconstruction with 4 strands versus 8 strands of hamstring tendon graft. Methods: Seventy-six patients with chronic ACL rupture were randomly separated into two groups for double-bundle ACL reconstruction. In the 4-strand hamstring graft (4SHG) group, the semitendinosus tendon was used to make two 2-stranded hamstring tendon grafts, whereas in the 8-strand hamstring graft (8SHG) group, the sernitendinosus tendon was used to make one 4SHG and the gracilis tendon was used to make the other 4SHG. The 4SHG group comprised 33 patients and the 8SHG group comprised 35 patients, with a minimum follow-up of 2 years. International Knee Documentation Committee (IKDQ and Lysholm scales were used to evaluate the clinical results. Results: In the 4SHG group the side-to-side difference was less than 3 mm in 26 patients (78.8%), 3 to 5 mm in 4 patients (12.1%), and 6 to 10 inm in 3 patients (9.0%), with a mean value of 2.8 +/- 0.5 mm; the pivot-shift test was negative in 29 patients (89.9%) and positive in 4 (12.1%). In the 8SHG group the side-to-side difference was less than 3 mm in 32 patients (91.4%), 3 to 5 mm in 2 patients (5.7%), and 6 mm in I patient (2.9%) (P =.004), with a mean value of 1.3 +/- 0.4 mm (P =.0003); the pivot-shift test was negative in 34 patients (97.1%) and positive in 1 (2.9%). According to the IKDC scale, 29 patients (87.9%) in the 4SHG group and 33 patients (94.3%) in the 8SHG group had a grade of normal or nearly normal. In the 4SHG and 8SHG groups the mean IKDC subjective knee evaluation results were 86.4 +/- 4.2 and 96.3 2.8 (P =.0007), respectively, and the mean Lysholm scores were 89.6 +/- 3.7 and 96.5 +/- 2.9 (P.0006), respectively. Conclusions: On the basis of KT-1000 examination (MEDmetric, San Diego, CA) and clinical measures, doublebundle ACL reconstruction with 8SHG yields significantly better results than double-bundle ACL reconstruction with 4SHG, with a mean side-to-side difference in anterior knee laxity of 1.3 _- 0.4 rum versus 2.8 +/- 0.5 rum (P =.0003), IKDC subjective result of 96.3 2.8 versus 86.4 +/- 4.2 (P =.0007), and Lysholm score of 96.5 2.9 versus 89.6 3.7 (P =.0006). Level of Evidence: Level 11, lesser-quality randomized controlled trial.",,,,,,,,,,,,,,,,,,,,,,,,JUL,2007,23,7,,,,,766,770,,10.1016/j.arthro.2007.01.022,http://dx.doi.org/10.1016/j.arthro.2007.01.022,,,,,,,,17637413,,,,,WOS:000248743900013,View Full Record in Web of Science
J,"Sundaraj, K; Salmon, LJ; Heath, EL; Winalski, CS; Colak, C; Vasanji, A; Roe, JP; Pinczewski, LA",,,,"Sundaraj, Keran; Salmon, Lucy J.; Heath, Emma L.; Winalski, Carl S.; Colak, Ceylan; Vasanji, Amit; Roe, Justin P.; Pinczewski, Leo A.",,,"Bioabsorbable Versus Titanium Screws in Anterior Cruciate Ligament Reconstruction Using Hamstring Autograft: A Prospective, Randomized Controlled Trial With 13-Year Follow-up",AMERICAN JOURNAL OF SPORTS MEDICINE,,,,,,,,,,,,"Background: Bioabsorbable screws for anterior cruciate ligament reconstruction (ACLR) have been a popular choice, with theoretical advantages in imaging and surgery. Titanium and poly-L-lactic acid with hydroxyapatite (PLLA-HA) screws have been compared, but with less than a decade of follow-up. Purpose/Hypothesis: The purpose was to compare long-term outcomes of hamstring autograft ACLR using either PLLA-HA screws or titanium screws. We hypothesized there would be no difference at 13 years in clinical scores or tunnel widening between PLLA-HA and titanium screw types, along with high-grade resorption and ossification of PLLA-HA screws. Study Design: Randomized controlled trial; Level of evidence, 1. Methods: Forty patients undergoing ACLR were randomized to receive either a PLLA-HA screw or a titanium screw for ACL hamstring autograft fixation. Blinded evaluation was performed at 2, 5, and 13 years using the International Knee Documentation Committee score, Lysholm knee score, and KT-1000 arthrometer. Magnetic resonance imaging (MRI) was performed at 2 or 5 years and 13 years to evaluate tunnel volumes, ossification around the screw, graft integration, and cyst formation. Computed tomography (CT) of patients with PLLA-HA was performed at 13 years to evaluate tunnel volumes and intratunnel ossification. Results: No differences were seen in clinical outcomes at 2, 5, or 13 years between the 2 groups. At 13 years, tibial tunnel volumes were smaller for the PLLA-HA group (2.17 cm(3)) compared with the titanium group (3.33 cm(3); P = .004). By 13 years, the PLLA-HA group had complete or nearly complete resorption on MRI or CT scan. Conclusion: Equivalent clinical results were found between PLLA-HA and titanium groups at 2, 5, and 13 years. Although PLLA-HA screws had complete or nearly complete resorption by 13 years, tunnel volumes remained largely unchanged, with minimal ossification.",,,,,,,,,,,,,,,,,,,,,,,,MAY,2020,48,6,,,,,1316,1326,3.63547E+14,10.1177/0363546520911024,http://dx.doi.org/10.1177/0363546520911024,,APR 2020,,,,,,32302205,,,,,WOS:000527754400001,View Full Record in Web of Science
J,"Lidén, M; Ejerhed, L; Sernert, N; Laxdal, G; Kartus, J",,,,"Liden, Mattias; Ejerhed, Lars; Sernert, Ninni; Laxdal, Gauti; Kartus, Juri",,,"Patellar tendon or semitendinosus tendon autografts for anterior cruciate ligament reconstruction -: A prospective, randomized study with a 7-year follow-up",AMERICAN JOURNAL OF SPORTS MEDICINE,,,,,,,,,,,,"Background: The aim of the study was to compare the results after arthroscopic anterior cruciate ligament (ACL) reconstruction using central-third bone-patellar tendon-bone (BTB) autografts and triple/quadruple semitendinosus (ST) autografts. Hypothesis: In the long-term, ACL reconstruction using BTB autografts will render more donor-site problems than ST autografts. Study Design: Randomized controlled trial; Level of evidence, 1. Methods: A randomized series of 71 patients (22 women and 49 men) with a unilateral ACL rupture who underwent reconstructive surgery were included in the study. The BTB graft was used in 34 patients (BTB group) and the ST-tendon graft was used in 37 patients (ST group). The patients were examined a median of 86 months (range, 68 to 114 months) after the reconstruction. Results: Sixty-eight of 71 patients (96%) were examined at follow-up. The clinical assessments at follow-up revealed no significant differences between the BTB group and the ST group in terms of the Lysholm score, Tegner activity level, International Knee Documentation Committee evaluation system, 1-legged hop test, KT-1000 arthrometer laxity measurements, manual Lachman test, and range of motion. A significant improvement was seen in both groups compared with the preoperative values in terms of most clinical assessments. Donor-site morbidity in the form of knee-walking ability, kneeling ability, and area of disturbed anterior knee sensitivity revealed no significant differences between the groups. Conclusion: Seven years after ACL reconstruction, the subjective and objective outcomes were similar after using the central-third BTB autograft and triple/quadruple ST autograft. Furthermore, no difference in terms of donor-site morbidity was found between the 2 groups.",,,,,,,,,,,,,,,,,,,,,,,,MAY,2007,35,5,,,,,740,748,,10.1177/0363546506298275,http://dx.doi.org/10.1177/0363546506298275,,,,,,,,17293471,,,,,WOS:000246264600006,View Full Record in Web of Science
J,"Laxdal, G; Kartus, J; Eriksson, BI; Faxén, E; Sernert, N; Karlsson, J",,,,"Laxdal, Gauti; Kartus, Jueri; Eriksson, Bengt I.; Faxen, Eva; Sernert, Ninni; Karlsson, Jon",,,Biodegradable and metallic interference screws in anterior cruciate ligament reconstruction surgery using hamstring tendon grafts -: Prospective randomized study of radiographic results and clinical outcome,AMERICAN JOURNAL OF SPORTS MEDICINE,,,,,,,,,,,,"Background: The use of biodegradable screws in anterior cruciate ligament reconstruction has grown in popularity. Purpose: To compare the clinical and radiographic results in arthroscopically assisted anterior cruciate ligament reconstruction using 4-strand hamstring tendon grafts and either metallic (metal group) or biodegradable (PLLA group) interference screw fixation. Study Design: Randomized controlled trial; Level of evidence, 1. Methods: A randomized series of 77 patients, all with a unilateral anterior cruciate ligament rupture, was included in the study. The preoperative assessments in both groups were similar in gender, Tegner activity level, Lysholm score, KT-1000 arthrometer measurements, and single-legged hop test results. In both groups, interference screw fixation of the graft was used at both ends, and 68 of 77 (88%) patients returned for a radiographic examination at 6 and 24 months, respectively. Results: At follow-up, no significant differences were found between the 2 groups in KT-1 000 arthrometer laxity measurements, Tegner activity level, or Lysholm score. The PLLA group had a significantly better outcome in the single-begged hop test and the final International Knee Documentation Committee classification (P =.007 and P =.03, respectively). At 6 and 24 months after the index operation, the PLLA group displayed significantly larger drill holes on the radiographs than did the metal group on both the tibial (8.1 vs 6.6 mm at 6 months [P =.0007]; 6.0 vs 3.2 mm at 24 months [P <.0001]) and femoral sides (7.8 vs 5.6 mm at 6 months [P <.0001]; 6.3 vs 1.9 mm at 24 months [P <.0001]). Conclusion: There were significantly larger radiographically visible drill holes on both the tibial and femoral sides in the PLLA group compared with the metal group at 6 and 24 months. Clinical examination at 2 years revealed no major differences between the groups. The larger drill holes in the PLLA group did not correlate with inferior clinical results.",,,,,,,,,,,,,,,,,,,,,,,,OCT,2006,34,10,,,,,1574,1580,,10.1177/0363546506288014,http://dx.doi.org/10.1177/0363546506288014,,,,,,,,16685087,,,,,WOS:000240833400003,View Full Record in Web of Science
J,"Lui, PPY; Cheng, YY; Yung, SH; Hung, ASL; Chan, KM",,,,"Lui, Pauline Po Yee; Cheng, Ying Ying; Yung, Shu Hang; Hung, Aaron See Long; Chan, Kai Ming",,,A randomized controlled trial comparing bone mineral density changes of three different ACL reconstruction techniques,KNEE,,,,,,,,,,,,"Introduction: This study aimed to compare the changes in bone mineral density (BMD) of three different ACL reconstruction (ACLR) techniques and its association with early clinical and functional outcomes. Methods: Sixty-two male adult patients undergoing primary ACLR were prospectively parallel randomized to bone-patellar tendon-bone graft (BPTB), single-bundle (HT-SB) or double-bundle (HT-DB) hamstring graft. BMD (primary outcome) at the proximal tibia, distal femur, femoral neck and trochanteric region was measured blindly at day 1, 3 months, 5 months and 1 year after surgery. KT-1000, Lysholm, IKDC, one-leg hop test and Lachman test were performed blindly at baseline and 1 year post-reconstruction. Results: There was a significant bone loss at the injured knee and hip at 3 and 5 months which was reversible at the knee, but not at the hip, at 1 year post-operation. There was a significant improvement of early clinical and functional outcomes at 1 year. No significant differences in bone loss was detected among different surgical techniques, except BMD loss at the femoral neck, though a trend of greater BMD loss in the HT-SB group at 5 months after reconstruction was observed. There was a significant positive correlation between BMD at the distal femur and the single-leg hop distance at 1 year. Conclusion: In conclusion, the three surgical techniques were similar in transient bone loss at the knee region, irreversible bone loss at the hip, early clinical and functional outcomes up to 1 year post-reconstruction. BMD at the distal femur was positively associated with the single-leg hop distance at 1 year post-reconstruction. (C) 2012 Elsevier B.V. All rights reserved.",,,,,,,,,,,,,,,,,,,,,,,,DEC,2012,19,6,,,,,779,785,,10.1016/j.knee.2012.02.005,http://dx.doi.org/10.1016/j.knee.2012.02.005,,,,,,,,22425308,,,,,WOS:000311329300009,View Full Record in Web of Science
J,"Fu, CLA; Yung, SHP; Law, KYB; Leung, KHH; Lui, PYP; Siu, HK; Chan, KM",,,,"Fu, Chak Lun Allan; Yung, Shu Hang Patrick; Law, Kan Yip Billy; Leung, King Ho Holly; Lui, Po Yee Pauline; Siu, Hon Kit; Chan, Kai Ming",,,The Effect of Early Whole-Body Vibration Therapy on Neuromuscular Control After Anterior Cruciate Ligament Reconstruction A Randomized Controlled Trial,AMERICAN JOURNAL OF SPORTS MEDICINE,,,,,,,,,,,,"Background: Despite rehabilitation training, deficiency in knee joint position sense, muscular performance, postural control, and functional ability is common after anterior cruciate ligament reconstruction (ACLR). Whole-body vibration therapy (WBVT), which is initiated from 3 months postoperatively, has proven benefits. However, the effect of earlier WBVT is unknown. Purpose: To investigate the effect of early WBVT on neuromuscular control after ACLR. Study Design: Randomized controlled trial; Level of evidence, 1. Methods: A total of 48 patients with unilateral complete isolated ACL tears were recruited. Single-bundle hamstring ACLR was performed in all patients. After surgery, they were randomly assigned to either the reference or treatment group. Reference group patients received conventional ACL rehabilitation, while treatment group patients received 8 weeks of WBVT in addition to conventional rehabilitation, starting from 1 month postoperatively. Joint position sense, postural control, and knee isokinetic performance were assessed before surgery and at 1, 3, and 6 months postoperatively using the Biodex dynamometer, Biodex Stability System, and Cybex NORM, respectively. Knee range of motion (ROM), stability (manual testing and KT-1000 arthrometer), and functional ability (single-legged hop test, triple hop test, shuttle run test, and carioca test) were also examined. Two-way repeated-measures analysis of variance and the Mann-Whitney U test were used for statistical analysis. Results: There was no complication throughout the rehabilitation. All patients achieved full knee ROM and stable knee joints at 6 months after surgery. The WBVT group demonstrated significantly better postural control, muscle performance, single-legged hop, and shuttle run (P<.05) than the reference group, but there was no significant difference in knee joint position sense, triple hop, carioca, ROM, and stability (P>.05). Conclusion: Early WBVT started from 1 month postoperatively was an effective training method without compromising knee ROM and stability. It improved postural control, isokinetic performance, single-legged hop, and shuttle run but not knee joint position sense, triple hop, and carioca.",,,,,,,,,,,,,,,,,,,,,,,,APR,2013,41,4,,,,,804,814,,10.1177/0363546513476473,http://dx.doi.org/10.1177/0363546513476473,,,,,,,,23460328,,,,,WOS:000318295500020,View Full Record in Web of Science
J,"Krishna, L; Chan, CX; Lokaiah, L; Chinnasamy, D; Goyal, S; Wang, MC; Singh, A",,,,"Krishna, Lingaraj; Chan, Chloe Xiaoyun; Lokaiah, Lakshmipathi; Chinnasamy, Duraimurugan; Goyal, Saumitra; Wang, Mingchang; Singh, Amritpal",,,Five-Strand Versus Four-Strand Hamstring Autografts in Anterior Cruciate Ligament Reconstruction-A Prospective Randomized Controlled Study,ARTHROSCOPY-THE JOURNAL OF ARTHROSCOPIC AND RELATED SURGERY,,,,,,,,,,,,"Purpose: To compare the clinical outcomes of the routine use of 5-strand hamstring grafts (where possible) with those of 4-strand grafts in primary anterior cruciate ligament (ACL) reconstruction. Methods: A total of 64 patients were enrolled in a prospective randomized controlled study comparing the use of 5-strand and 4-strand semitendinosus-gracilis autografts in single bundle ACL reconstruction (n = 32 in each group). Four participants in each group were lost to follow-up and were excluded from the outcome analysis. The outcomes of 28 patients in the 5-strand group and 28 patients in the 4-strand group were analyzed. The diameters of all grafts were measured intraoperatively. Patients were assessed post-operatively at 2 years with objective assessments (anterior knee laxity using the KT-2000 arthrometer, Lachman test, pivot-shift test, hop test) and patient-reported outcome scores (Lysholm knee score, Knee Injury and Osteoarthritis Outcome Score, International Knee Documentation Committee subjective knee score, SF-36 physical and mental components, Tegner activity scale). Postoperative graft ruptures were also noted. Results: There were improvements in all outcome measures postoperatively regardless of the number of graft strands. When we compared the study and control groups, there were no significant differences in all subjective and objective outcome measures except the Knee Injury and Osteoarthritis Outcome Score symptoms score (5-strand group 93.3 +/- 9.2 vs 4-strand group 86.2 +/- 14.7, P = .04). The KT-2000 side-to-side difference was 2.79 +/- 2.11 mm in the 5-strand group and 2.54 +/- 1.75 mm in the 4-strand group (P = .63). The 5-strand study group had 2 graft ruptures at 1 year, whereas the 4-strand control group had one partial graft rupture at 6 months. Conclusions: At 2-year follow-up, the routine use of the 5-strand hamstring tendon autograft was not superior to that of the quadrupled or 4-strand graft in primary ACL reconstruction. Level of Evidence: Level I, prospective randomized controlled trial.",,,,,,,,,,,,,,,,,,,,,,,,FEB,2021,37,2,,,,,579,585,,10.1016/j.arthro.2020.08.012,http://dx.doi.org/10.1016/j.arthro.2020.08.012,,FEB 2021,,,,,,32828934,,,,,WOS:000631872100033,View Full Record in Web of Science
J,"Konrads, C; Reppenhagen, S; Plumhoff, P; Hoberg, M; Rudert, M; Barthel, T",,,,"Konrads, Christian; Reppenhagen, Stephan; Plumhoff, Piet; Hoberg, Maik; Rudert, Maximilian; Barthel, Thomas",,,No significant difference in clinical outcome and knee stability between patellar tendon and semitendinosus tendon in anterior cruciate ligament reconstruction,ARCHIVES OF ORTHOPAEDIC AND TRAUMA SURGERY,,,,,,,,,,,,"ACL reconstruction with either patellar tendon or semitendinosus tendon autografts are standard procedures. Between these two grafts might be differences in stability, morbidity, or long-term changes. This study investigates outcomes of ACL reconstruction with patellar tendon versus semitendinosus tendon autografts. We hypothesize no significant differences in clinical outcome and knee stability between both groups. In a randomized prospective trial, we operated 62 ACL-deficient patients, 45 males and 17 females with a mean age of 29.8 years (min. 18, max. 44). We reconstructed the ligament using either autologous patellar tendon (n = 31) or semitendinosus tendon (n = 31). After 10 years of follow-up, we investigated 47 patients of the study. For evaluation we used a standard clinical examination including one-leg jump test and KT-1000 instrumental translation measure, visual analog pain scale, IKDC subjective knee form, Lysholm score, Tegner activity scale, and standard X-rays of the knee. The data did not show any significant differences between the two groups. Between 5 and 10 years after ACL reconstruction both groups started to develop degenerative arthritic changes, which were detectable in standard radiographs of the knee. At 10-year follow-up mean IKDC for the BPTB group was 1.8 (min. 1, max. 3) and for the ST group it was 2.2 (min 1, max. 4), p = 0.35. Regarding Tegner activity scale after 10 years, the BPTB group showed a mean score of 5.9 (min. 4, max. 9) versus 5.1 (min. 3, max. 7) in the ST group, p = 0.53. For the Lysholm score the BPTB group reached a mean of 92.0 (min. 63, max. 98) and the ST group 91.8 (min. 62, max. 98) points, p = 0.66. There is a tendency for higher donor site morbidity in the BPTB group than in the ST group, p = 0.07. Both, patellar tendon and semitendinosus tendon are safe autografts for ACL reconstruction. Regarding graft selection, individual patient-dependent factors should be considered. ACL reconstruction cannot fully restore pre-injury status of knee joint function in the majority of cases.",,,,,,,,,,,,,,,,,,,,,,,,APR,2016,136,4,,,,,521,525,,10.1007/s00402-015-2386-4,http://dx.doi.org/10.1007/s00402-015-2386-4,,,,,,,,26725050,,,,,WOS:000373179000012,View Full Record in Web of Science
J,"Grunau, PD; Arneja, S; Leith, JM",,,,"Grunau, Peter David; Arneja, Shalinder; Leith, Jordan Michael",,,A Randomized Clinical Trial to Assess the Clinical Effectiveness of a Measured Objective Tensioning Device in Hamstring Anterior Cruciate Ligament Reconstruction,AMERICAN JOURNAL OF SPORTS MEDICINE,,,,,,,,,,,,"Background: Soft tissue grafts are commonly used in surgical reconstruction of the anterior cruciate ligament (ACL). Applying the appropriate tension to the final graft reconstruction has traditionally been performed by the surgeon and is based on the surgeon's experience and perception of applied tension. Problems with manual application of tension to the ACL reconstruction include under- or overtightening the reconstruction, inconsistent tension application among subjects, and variable load application to each strand. Purpose: To assess whether measured tensioning of hamstring ACL grafts during fixation improves clinical outcome or knee laxity postoperatively when compared with conventional tensioning maneuvers. Study Design: Randomized controlled trial; Level of evidence, 1. Methods: This was a prospective randomized controlled trial of consecutive primary ACL patients. The device group included patients in whom a measured tensioning device was used for graft tensioning (80 N), and the physician group did not use a tensioning device. The primary outcome was KT-1000 arthrometer side-to-side laxity differences between knees at 6, 12, and 18 months postoperatively. Secondary outcomes included the International Knee Documentation Committee (IKDC) Subjective Knee Evaluation Form and Anterior Cruciate Ligament Quality of Life Questionnaire (ACL-QoL) at those intervals. Chi-square and t tests were used for analysis. The study had 90% power to detect a difference of 2 mm between groups. Results: A sample of 127 patients was randomized. Of those, 14 did not have follow-up data and were excluded from this analysis, resulting in a final sample of 113 (55 patients in the device group and 58 in the physician group). No significant differences were found in baseline demographics or comorbidities. There were no significant differences between the groups (physician vs device) at baseline and at 6, 12, and 18 months in side-to-side laxity (4.6 vs 4.7 mm, 1.6 vs 1.3 mm, 1.5 vs 1.3 mm, and 1.1 vs 1.0 mm, respectively), IKDC score (58.2 vs 56.4, 72.0 vs 67.9, 79.9 vs 76.0, and 81.3 vs 78.5, respectively), or ACL-QoL score (998.2 vs 901.2, 1846.4 vs 1647.5, 2150.4 vs 2268.3, and 2436.9 vs 2231.8, respectively). Conclusion: Measured tensioning of hamstring ACL grafts during fixation does not improve clinical outcome or knee laxity postoperatively when compared with conventional tensioning maneuvers.",,,,,,,,,,,,,,,,,,,,,,,,JUN,2016,44,6,,,,,1482,1486,,10.1177/0363546516634021,http://dx.doi.org/10.1177/0363546516634021,,,,,,,,26980844,,,,,WOS:000377821700023,View Full Record in Web of Science
