J,"Borges, JHD; Oliveira, M; Lobo, P; Machado, RD; Lima, R; Ramos, LA; Cohen, M",,,,"de Souza Borges, Jose Humberto; Oliveira, Marcio; Lobo Junior, Paulo; Machado, Ronny de Souza; Lima, Revia; Ramos, Leonardo Addeo; Cohen, Moises",,,Is contralateral autogenous patellar tendon graft a better choice than ipsilateral for anterior cruciate ligament reconstruction in young sportsmen? A randomized controlled trial,KNEE,,,,,,,,,,,,"Aim: The aim of this study was to compare the peak extensor torque (primary outcome), sensory-motor capacity and Lysholm questionnaire score up to the fourth postoperative month post-primary anterior cruciate ligament reconstruction (ACLR) with bone-patel lar-tendon-bone (BPTB) graft using either ipsilateral or contralateral technique in young sportsmen. Methods: We performed a randomized controlled trial from 2018 to 2019. The same preoperative protocol, surgical technique and postoperative protocol were used in both groups. Eighty-eight young adult male patients were randomized, and 44 of each group completed the trial. Results: After the follow up analysis, the contralateral receptor and donor limb demonstrated a statistically significant increase in peak extension torque compared with the ipsilateral operated limb (effect size (ES) = 0.99, power = 0.99, P < 0.0001; ES = 0.46, power = 0.56, P < 0.04). The symmetry between limbs was compared between groups. In the contralateral group, there was a significant decrease in the recipient limb (after surgery), compared with the donor limb (before surgery) (ES = 0.87, power = 0.99, P < 0.0001). In the ipsilateral group, the operated limb demonstrated a significant decrease in peak extension torque compared with the non-operated limb after surgery (ES = 1.88, power = 0.99, P < 0.0001). The comparison between groups in sensory-motor capacity and Lysholm score demonstrated a non-significant group effect postoperatively. Conclusion: The use of contralateral BPTB is more effective in increasing peak extension torque when compared with ipsilateral technique in young sportsmen. Furthermore, patients achieved greater symmetry (side to side) in quadriceps muscle performance after the 4-month follow up with a contralateral graft. (c) 2022 Elsevier B.V. All rights reserved.",,,,,,,,,,,,,,,,,,,,,,,,JUN,2022,36,,,,,,33,43,,10.1016/j.knee.2022.03.015,http://dx.doi.org/10.1016/j.knee.2022.03.015,,APR 2022,,,,,,35468330,,,,,WOS:000793732300005,View Full Record in Web of Science
J,"Barenius, B; Ponzer, S; Shalabi, A; Bujak, R; Norlén, L; Eriksson, K",,,,"Barenius, Bjorn; Ponzer, Sari; Shalabi, Adel; Bujak, Robert; Norlen, Louise; Eriksson, Karl",,,Increased Risk of Osteoarthritis After Anterior Cruciate Ligament Reconstruction A 14-Year Follow-up Study of a Randomized Controlled Trial,AMERICAN JOURNAL OF SPORTS MEDICINE,,,,,,,,,,,,"Background: The reported prevalence of radiological osteoarthritis (OA) after anterior cruciate ligament (ACL) reconstruction varies from 10% to 90%. Purpose/Hypothesis: To report the prevalence of OA after ACL reconstruction and to compare the OA prevalence between quadrupled semitendinosus tendon (ST) and bone-patellar tendon-bone (BPTB) grafts. The hypothesis was that there would be no difference in OA prevalence between the graft types. The secondary aim was to study whether patient characteristics and additional injuries were associated with long-term outcomes. Study Design: Randomized controlled trial; Level of evidence, 1. Methods: Radiological examination results, Tegner activity levels, and Knee injury and Osteoarthritis Outcome Score (KOOS) values were determined in 135 (82%) of 164 patients at a mean of 14 years after ACL reconstruction randomized to an ST or a BPTB graft. Osteoarthritis was defined according to a consensus by at least 2 of 3 radiologists of Kellgren-Lawrence grade >= 2. Using regression analysis, graft type, sex, age, overweight, time between injury and reconstruction, additional meniscus injury, and a number of other variables were assessed as risk factors for OA 14 years after ACL reconstruction. Results: Osteoarthritis of the medial compartment was most frequent, with 57% of OA cases in the ACL-reconstructed knee and 18% of OA cases in the contralateral knee (P < .001). There was no difference between the graft types: 49% of OA of the medial compartment for BPTB grafts and 65% for ST grafts (P = .073). The KOOS results were lower for patients with OA in all subscales, indicating that OA was symptomatic. No difference in the KOOS between the graft types was found. Meniscus resection was a strong risk factor for OA of the medial compartment (odds ratio, 3.6; 95% CI, 1.4-9.3) in the multivariable logistic regression analysis. Conclusion: A 3-fold increased prevalence of OA was found after an ACL injury treated with reconstruction compared with the contralateral healthy knee. No differences in the prevalence of OA between the BPTB and quadrupled ST reconstructions were found. An initial meniscus resection was a strong risk factor for OA; the time between injury and reconstruction was not.",,,,,,,,,,,,,,,,,,,,,,,,MAY,2014,42,5,,,,,1049,1057,,10.1177/0363546514526139,http://dx.doi.org/10.1177/0363546514526139,,,,,,,,24644301,,,,,WOS:000335567700003,View Full Record in Web of Science
J,"McRae, S; Leiter, J; McCormack, R; Old, J; MacDonald, P",,,,"McRae, Sheila; Leiter, Jeff; McCormack, Robert; Old, Jason; MacDonald, Peter",,,Ipsilateral Versus Contralateral Hamstring Grafts in Anterior Cruciate Ligament Reconstruction A Prospective Randomized Trial,AMERICAN JOURNAL OF SPORTS MEDICINE,,,,,,,,,,,,"Background: Benefits of graft harvest from the side contralateral to the anterior cruciate ligament (ACL)-deficient leg have been identified when using bone-patellar tendon-bone autografts in ACL reconstruction (ACLR). As hamstring tendon autografts are becoming more commonly used, a study examining the effect of contralateral graft harvest of semitendinosus gracilis (STG) tendons on patient quality of life was conducted. Purpose: To evaluate if ACLR using a hamstring tendon autograft results in better patient quality of life if the graft is harvested from the leg contralateral to the ACL rupture compared with the ipsilateral leg. Study Design: Randomized controlled trial; Level of evidence, 1. Methods: A total of 100 participants between 16 and 50 years of age with a complete ACL tear were randomly assigned to undergo ACLR using either the ipsilateral or contralateral leg as the STG graft donor. Primary outcome measures were the ACL Quality of Life questionnaire (ACL-QOL), concentric knee flexion and extension strength at 60 and 240 deg/s, International Knee Documentation Committee (IKDC) knee assessment form, early postoperative pain and diary of analgesic use, and rate of reruptures. Outcome measures were evaluated before surgery and at 3, 6, 12, and 24 months after surgery. Results: The ACL-QOL score improved over time for both groups (P < .001), and there were no significant differences between groups at any time point (P = .528). Significant differences in knee flexion and extension strength were found at 3 months after surgery. There were no differences between groups in IKDC knee assessment scores or rerupture rates. Conclusion: There does not appear to be any measurable benefit or drawback in quality of life to the use of an STG graft from the unaffected limb. In light of this finding, further research to examine other possible effects on agility and balance as well as time and ability to return to sport should be conducted. Longer term follow-up beyond 2 years would allow for a more thorough evaluation of the risk of reruptures or contralateral reruptures using this novel approach.",,,,,,,,,,,,,,,,,,,,,,,,NOV,2013,41,11,,,,,2492,2499,,10.1177/0363546513499140,http://dx.doi.org/10.1177/0363546513499140,,,,,,,,24001575,,,,,WOS:000326453500005,View Full Record in Web of Science
J,"Cantin, O; Lustig, S; Rongieras, F; Saragaglia, D; Lefèvre, N; Graveleau, N; Hulet, C",,,,"Cantin, O.; Lustig, S.; Rongieras, F.; Saragaglia, D.; Lefevre, N.; Graveleau, N.; Hulet, C.",,Soc Francaise Chirurg Orthopedique,Outcome of cartilage at 12 years of follow-up after anterior cruciate ligament reconstruction,ORTHOPAEDICS & TRAUMATOLOGY-SURGERY & RESEARCH,,,,,,,,,,,,"Introduction: In cases of chronic anterior laxity, reconstruction of the anterior cruciate ligament (ACL) can slow the development of osteoarthritis. This study was conducted to determine the overall prevalence of osteoarthritis and to identify the risk factors after ACL reconstruction. Hypothesis: Meniscus tears, time from injury to surgery, body mass index (BMI), residual laxity, and cartilage lesions influence the progression towards osteoarthritis. Materials and methods: This multicenter, retrospective study on the outcome of cruciate ligaments at 12 years of follow-up was conducted within the 2014 SOFCOT Symposium. The cohort included 675 arthroscopic reconstructions of the ACL from January 2002 to December 2003. The clinical evaluation included the objective and subjective IKDC score. Osteoarthritis was analyzed on 589 knee X-rays according to the IKDC classification. The predictive factors of osteoarthritis development studied were age, gender, BMI, time from injury to surgery, activity level, medial or lateral meniscectomy, type of graft, medial or lateral chondropathy, tunnel positioning, and residual laxity. Univariate and multivariate analyses with logistic regression were performed. Results: The mean follow-up was 11.9 +/- 0.8 years. The subjective IKDC score was 83.7 +/- 13. At 12 years, the rate of moderate to severe osteoarthritis 1 (IKIX C or D) was 19% (16% medial tibiofemoral osteoarthritis, 4% lateral tibiofemoral osteoarthritis, and 2% patellofemoral osteoarthritis). The prognostic factors were age at surgery greater than 34 years (P<0.05), cartilage lesions at surgery (P<0.05), medial or lateral meniscectomy (P < 0.05), and residual laxity (A < 0.05). Conclusions: This large-scale study identified risk factors for osteoarthritis that should improve the information provided to patients on long-term progression after ACL reconstruction. (C) 2016 Elsevier Masson SAS. All rights reserved.",,,,,,,,,,,,,,,,,,,,,,,,NOV,2016,102,7,,,,,857,861,,10.1016/j.otsr.2016.06.011,http://dx.doi.org/10.1016/j.otsr.2016.06.011,,,,,,,,27544885,,,,,WOS:000389540400005,View Full Record in Web of Science
J,"Lecoq, FA; Parienti, JJ; Murison, J; Ruiz, N; Bouacida, K; Besse, J; Morin, V; Padiolleau, G; Cucurulo, T; Graveleau, N; Hulet, C",,,,"Lecoq, Flore-Anne; Parienti, Jean-Jacques; Murison, James; Ruiz, Nicolas; Bouacida, Khaled; Besse, Jeremy; Morin, Vincent; Padiolleau, Giovany; Cucurulo, Thomas; Graveleau, Nicolas; Hulet, Christophe",,Soc Francaise Chirurg Orthopedique,Graft Choice and the Incidence of Osteoarthritis After Anterior Cruciate Ligament Reconstruction A Causal Analysis From a Cohort of 541 Patients,AMERICAN JOURNAL OF SPORTS MEDICINE,,,,,,,,,,,,"Background: Anterior cruciate ligament (ACL) reconstruction is important to prevent knee osteoarthritis. Neither of the 2 most common graft techniques-the patellar tendon (PT) or hamstring tendon (HS) graft-has demonstrated superiority in terms of the long-term osteoarthritis rate. Hypothesis: Based on the International Knee Documentation Committee (IKDC) radiographic grading system, PT grafts decrease the incidence of osteoarthritis by providing better knee stability as compared with HS grafts over 12 years of follow-up. Study Design: Cohort study; Level of evidence, 3. Methods: All adults with a first ACL rupture who underwent surgery with a PT or HS graft technique between January 2002 and December 2003 were included in the 2014 French Society of Orthopedic Surgery and Traumatology Symposium database. Baseline characteristics were collected. The primary endpoint was the occurrence of moderate to severe osteoarthritis in each group. The secondary endpoints included clinical subjective evaluations by the IKDC score and Knee injury and Osteoarthritis Outcome Score. To control the differences in baseline characteristics, the data were analyzed with propensity score matching. Results: In the cohort, 541 patients from 18 centers were included: 311 PT and 230 HS ACL reconstructions. The baseline characteristics were similar after inverse probability weighting treatment (IPWT). The occurrence of osteoarthritis was similar after IPWT (19.3% for PT and 19.6% for HS, P = .94). Age at surgery >29 years and IKDC osteoarthritis stage B at the index surgery were identified as risk factors for moderate to severe osteoarthritis. Most functional outcomes were significantly higher in the HS group; however, the difference between groups remained <10 points. Of the 106 patients who needed a medial meniscectomy, the proportion of patients with moderate to severe osteoarthritis was much higher in the HS group (43.5% vs 18.3%, P = .006). However, after IPWT, the difference was not statistically significant. Conclusion: At 12 years of follow-up, neither graft technique was superior to the other in terms of the rate of osteoarthritis.",,,,,,,,,,,,,,,,,,,,,,,,OCT,2018,46,12,,,,,2842,2850,,10.1177/0363546518795137,http://dx.doi.org/10.1177/0363546518795137,,,,,,,,30199646,,,,,WOS:000446347200008,View Full Record in Web of Science
J,"Sasaki, S; Tsuda, E; Hiraga, Y; Yamamoto, Y; Maeda, S; Sasaki, E; Ishibashi, Y",,,,"Sasaki, Shizuka; Tsuda, Eiichi; Hiraga, Yasuharu; Yamamoto, Yuji; Maeda, Shugo; Sasaki, Eiji; Ishibashi, Yasuyuki",,,Prospective Randomized Study of Objective and Subjective Clinical Results Between Double-Bundle and Single-Bundle Anterior Cruciate Ligament Reconstruction,AMERICAN JOURNAL OF SPORTS MEDICINE,,,,,,,,,,,,"Background: There is controversy as to whether double-bundle anterior cruciate ligament (ACL) reconstruction with hamstring tendon graft (DB-HT) or single-bundle ACL reconstruction with patellar tendon graft (SB-PT) obtains the best clinical outcomes. Purpose: To compare the short-term clinical outcomes of DB-HT with those of rectangular-tunnel SB-PT (RTSB-PT) at 2-year follow-up and to identify the factors that affect subjective knee functional score. Study Design: Randomized controlled trial. Level of evidence, 1. Methods: Sixty-three male patients (mean age, 26.1 years) and 87 female patients (mean age, 25.8 years) were included in this study and were randomly distributed to either the DB-HT (n = 76) or RTSB-PT (n = 74) group. Clinical outcomes (knee flexion range of motion [ROM], heel-height difference, side-to-side difference in anterior laxity, rotational laxity, and Tegner activity score) were compared between the DB-HT and RTSB-PT groups, and examination of factors affecting subjective outcomes (Knee Injury and Osteoarthritis and Outcome Score [KOOS] results) was performed by multiple linear regression analysis. Results: Fourteen patients (9 DB-HT, 5 RTSB-PT) had secondary ACL injury within 2 years after primary ACL reconstruction and were excluded from analysis. In the examination of 136 patients at the 24-month follow-up, there was no significant difference between the 2 groups in clinical or subjective outcomes. The normalized knee extensor strength of the RTSB-PT group showed negative surgical technique effect in the early postoperative phase (P = .005), but there was no significant difference between the 2 groups at the 24-month follow-up (P = .114). There was no significant difference in change of normalized knee flexor strength between the 2 groups (P = .493). Age, sex, body mass index (BMI), and presence of meniscus injury were the factors that affected KOOS subscale scores. Conclusion: In this prospective randomized controlled study, there was no significant difference in the incidence of secondary ACL injury and no difference in objective or subjective outcomes between the DB-HT and RTSB-PT reconstruction at 24-month follow-up. Age, sex, presence of meniscus injury, and BMI affected subjective KOOS subscale scores, while surgical technique did not.",,,,,,,,,,,,,,,,,,,,,,,,APR,2016,44,4,,,,,855,864,,10.1177/0363546515624471,http://dx.doi.org/10.1177/0363546515624471,,,,,,,,26838934,,,,,WOS:000373665800011,View Full Record in Web of Science
J,"Sonnery-Cottet, B; Pioger, C; Vieira, TD; Franck, F; Kajetanek, C; Fayard, JM; Thaunat, M; Saithna, A",,,,"Sonnery-Cottet, Bertrand; Pioger, Charles; Vieira, Thais Dutra; Franck, Florent; Kajetanek, Charles; Fayard, Jean-Marie; Thaunat, Mathieu; Saithna, Adnan",,,Combined ACL and Anterolateral Reconstruction Is Not Associated With a Higher Risk of Adverse Outcomes: Preliminary Results From the SANTI Randomized Controlled Trial,ORTHOPAEDIC JOURNAL OF SPORTS MEDICINE,,,,,,,,,,,,"Background: The widespread historical abandonment of lateral extra-articular procedures in anterior cruciate ligament (ACL) injuries occurred as a result of concerns about high rates of adverse events. Recently, the popularity of lateral extra-articular procedures has resurged, warranting an urgent evaluation of their safety profile. Purpose/Hypothesis: The aim of this study was to perform an interim analysis of the ongoing SANTI randomized controlled trial to determine whether combined ACL and anterolateral ligament reconstruction (ACL + ALLR) is associated with an increased rate of adverse outcomes when compared with isolated ACL reconstruction (ACLR). The hypothesis was that there would be no significant difference between groups at a minimum follow-up of 1 year. Study Design: Randomized controlled trial; Level of evidence, 1. Methods: Recruitment commenced in November 2016. Patients scheduled for ACLR were randomized to either isolated ACLR (with bone-patellar tendon-bone [BPTB] autograft) or combined ACL + ALLR (with hamstring tendon autograft). All patients with a minimum follow-up of 1 year by March 2019 were included. The evaluated parameters included complications and reoperations, knee laxity parameters, range of motion, and scores on the Tegner, Lysholm, International Knee Documentation Committee (IKDC), and Knee injury and Osteoarthritis Outcome Score (KOOS) instruments. Results: A total of 224 patients (112 in each group) with a mean +/- SD follow-up of 12.3 +/- 1.9 months (range, 12-19 months) formed the study population. A significantly higher rate of reoperation for cyclops syndrome was noted in the isolated ACLR group compared with the combined ACL + ALLR group (8.9% vs 0%, respectively; P = .0012). No significant differences were found in frequency of graft rupture (ACLR, 5.4%; ACL + ALLR, 0.9%; P = .1191), range of motion deficits, pain, or reoperation for meniscectomy between groups. No cases of postoperative infection, venous thromboembolism, or arthrofibrosis were seen. Subjective IKDC (81.2 vs 86.8; P = .0048), Lysholm (88 vs 92; P = .0131), and some components of the KOOS were significantly better in the combined ACL + ALLR group. Conclusion: This study demonstrates no evidence of an increased risk of short-term adverse events after combined ACL + ALLR compared with isolated ACLR with BPTB graft.",,,,,,,,,,,,,,,,,,,,,,,,MAY,2020,8,5,,,,,,,2.32597E+15,10.1177/2325967120918490,http://dx.doi.org/10.1177/2325967120918490,,,,,,,,32490026,,,,,WOS:000535893400001,View Full Record in Web of Science
J,"Mayr, HO; Stüeken, P; Münch, EO; Wolter, M; Bernstein, A; Suedkamp, NP; Stoehr, A",,,,"Mayr, Hermann O.; Stueeken, Paul; Muench, Ernst-Otto; Wolter, Morris; Bernstein, Anke; Suedkamp, Norbert P.; Stoehr, Amelie",,,Brace or no-brace after ACL graft? Four-year results of a prospective clinical trial,KNEE SURGERY SPORTS TRAUMATOLOGY ARTHROSCOPY,,,,,,,,,,,,"A controversial discussion is held on using stabilizing knee braces after anterior cruciate ligament (ACL) surgery. The current study investigated the influence of a stabilizing knee brace on results after ACL reconstruction using patellar tendon autografts. A prospective randomized study was started including 64 patients divided into two equal groups and treated with or without a stabilizing knee brace for 6 weeks post-operatively. A follow-up examination 4 years after operation comprised IKDC 2000, KT1000 measurement, a visual analogue pain scale (VAS; scores 0-10) and radiographic evaluation. The t test for independent and paired samples and the Pearson's Chi-square test were used for statistical analysis (p < 0.05). The primary endpoint was the difference in IKDC classification. Eighty-one per cent of the patients were examined 4 years post-operatively. IKDC 2000 subjective (brace group 90.5 +/- A 8.9, braceless group 93.2 +/- A 6.1) and objective results (brace A 30 %, B 56 %, C 16 %; braceless A 32 %, B 48 %, C 20 %) and instrumental measurement of anteroposterior laxity with KT1000 (brace 0.6 +/- A 2.4 mm, braceless 1.8 +/- A 3.4 mm) showed no significant differences. VAS pain results were significantly better in the braceless group at 1.0 +/- A 1.2 versus 1.9 +/- A 1.4 under sports activity or heavy physical work (p = 0.015). There were no radiographic differences concerning osteoarthritic findings and tunnel widening between the groups. Post-operative treatment with a stabilizing knee brace after ACL replacement showed no advantage over treatment without a brace at 4-year follow-up. The use of a knee-stabilizing brace after isolated ACL reconstruction with autologous patellar tendon graft is not recommended. II.",,,,,,,,,,,,,,,,,,,,,,,,MAY,2014,22,5,,,,,1156,1162,,10.1007/s00167-013-2564-2,http://dx.doi.org/10.1007/s00167-013-2564-2,,,,,,,,23807029,,,,,WOS:000334757600027,View Full Record in Web of Science
J,"Walters, BL; Porter, DA; Hobart, SJ; Bedford, BB; Hogan, DE; McHugh, MM; Klein, DA; Harousseau, K; Nicholas, SJ",,,,"Walters, Brian L.; Porter, David A.; Hobart, Sarah J.; Bedford, Benjamin B.; Hogan, Daniel E.; McHugh, Malachy M.; Klein, Devon A.; Harousseau, Kendall; Nicholas, Stephen J.",,,Effect of Intraoperative Platelet-Rich Plasma Treatment on Postoperative Donor Site Knee Pain in Patellar Tendon Autograft Anterior Cruciate Ligament Reconstruction A Double-Blind Randomized Controlled Trial,AMERICAN JOURNAL OF SPORTS MEDICINE,,,,,,,,,,,,"Background: Donor site morbidity in the form of anterior knee pain is a frequent complication after bone-patellar tendon-bone (BPTB) autograft anterior cruciate ligament (ACL) reconstruction. Hypothesis/Purpose: The purpose was to examine the effect of the intraoperative administration of platelet-rich plasma (PRP) on postoperative kneeling pain. It was hypothesized that PRP treatment would reduce knee pain. Study Design: Randomized controlled trial; Level of evidence, 2. Methods: Fifty patients (mean +/- SD age, 30 +/- 12 years) undergoing BPTB ACL autograft reconstruction were randomized to the PRP (n = 27) or sham (n = 23) treatment. In either case, 10 mL of venous blood was drawn before the induction of anesthesia and either discarded (sham) or processed (PRP) for preparation of a PRP gel to be later mixed with donor site bone chips and inserted into the patellar defect. At 12 weeks, 6 months, 1 year, and 2 years after surgery, patients completed International Knee Documentation Committee (IKDC) forms and visual analog scale pain scores for activities of daily living and kneeling. Healing indices at the donor site were assessed by routine noncontrast magnetic resonance imaging (MRI) at 6 months. Mixed-model analysis of variance was used to assess the effect of PRP on patient symptoms and MRI indices of donor site healing, as measured by the width of the donor site defect. Results: Kneeling pain, pain with activities of daily living, and IKDC scores were not different between treatment groups at any of the time intervals (P = .08-.83). Kneeling pain improved from 12 weeks to 6 months and from 1 to 2 years (P < .05). IKDC scores improved substantially from 12 weeks to 6 months (P < .001) and continued to improve to 2 years (PRP, 86 +/- 19; sham, 89 +/- 10). MRI indices of donor site healing were not different between treatment groups (P = .53-.90). Conclusion: Whether randomized to receive PRP in their patellar defect or not, patients continued to have similar levels of kneeling pain and patellar defect sizes after autograft BPTB ACL reconstruction.",,,,,,,,,,,,,,,,,,,,,,,,JUL,2018,46,8,,,,,1827,1835,,10.1177/0363546518769295,http://dx.doi.org/10.1177/0363546518769295,,,,,,,,29741923,,,,,WOS:000438619500010,View Full Record in Web of Science
